id,created_at,original_text,clean_text,polarity
1145278149263024130,Sun Jun 30 10:29:23 +0000 2019,“hey buddy ever thought about shipping cinderella with the fairy godmother?” https://t.co/qvhTSax4w2,“ hey buddy ever thought shipping cinderella fairy godmother ” https //t.co/qvhTSax4w2,0.0
1145041851411521536,Sat Jun 29 18:50:25 +0000 2019,@RianSygh @Gingerhazing blease....,RianSygh Gingerhazing blease ...,0.0
1145041763855491072,Sat Jun 29 18:50:05 +0000 2019,“i think your drawing is the best drawing in the room” https://t.co/qBKbmKohHS,“ think drawing best drawing room ” https //t.co/qBKbmKohHS,1.0
1145040934389846016,Sat Jun 29 18:46:47 +0000 2019,watching inkmaster and god nobody in inkmaster can draw huh,watching inkmaster god nobody inkmaster draw huh,0.0
1145040609234837505,Sat Jun 29 18:45:29 +0000 2019,@Gingerhazing also theyre not allowed to use paper and pencil to figure out the matches for whatever reason LMAO go… https://t.co/hBOyLCWNtv,Gingerhazing also theyre allowed use paper pencil figure matches whatever reason LMAO go… https //t.co/hBOyLCWNtv,0.6
1145039660747563008,Sat Jun 29 18:41:43 +0000 2019,@Gingerhazing oh my god i was Obsessed with that show for a while id give anything to play this,Gingerhazing oh god Obsessed show id give anything play,-0.5
1145038571662958593,Sat Jun 29 18:37:23 +0000 2019,brazilian followers send me ovinhos de amendoim challenge,brazilian followers send ovinhos de amendoim challenge,0.0
1144940284180123649,Sat Jun 29 12:06:50 +0000 2019,@corpseinthesky not if chrom has a higher rank with another girl (usually olivia is the designated Chrom Tribute),corpseinthesky chrom higher rank another girl usually olivia designated Chrom Tribute,-0.26666666666666666
1144939709489143808,Sat Jun 29 12:04:33 +0000 2019,@corpseinthesky heads up that if u get to s w any of the opposite gender of ur pc’s characters you automarry them w… https://t.co/H5e5YhWcEY,corpseinthesky heads u get w opposite gender ur pc ’ characters automarry w… https //t.co/H5e5YhWcEY,0.0
1144891398224777216,Sat Jun 29 08:52:35 +0000 2019,@thuthestars omg happy birthday!! 🎉✨,thuthestars omg happy birthday 🎉✨,0.8
1144882407012745218,Sat Jun 29 08:16:51 +0000 2019,@thuthestars omggg this is so cure!! im so happy you decided to share he looks adorable!,thuthestars omggg cure im happy decided share looks adorable,0.65
1144701226543648770,Fri Jun 28 20:16:54 +0000 2019,"like, https://t.co/KmlHIMQ2Y5",like https //t.co/KmlHIMQ2Y5,0.0
1144699469260382209,Fri Jun 28 20:09:55 +0000 2019,i dont go here but nothing on earth was funnier to me today than that clip in the lindsay ellis game of thrones vid… https://t.co/lU0JtBnMMT,dont go nothing earth funnier today clip lindsay ellis game thrones vid… https //t.co/lU0JtBnMMT,-0.4
1144328672863825921,Thu Jun 27 19:36:30 +0000 2019,bodyattack.. is an attack... on my body....,bodyattack.. attack ... body ...,0.0
1144180824788652032,Thu Jun 27 09:49:01 +0000 2019,@6ftbutch god BIG MOOD every time i come home for the summer its like guess whos back (its dysmorphia),6ftbutch god BIG MOOD every time come home summer like guess whos back dysmorphia,0.0
1144166492025626626,Thu Jun 27 08:52:03 +0000 2019,@instagram WHY CANT I SEE MY POSTS ONE BY ONE ANYMORE?????? https://t.co/WUEyPgaaa3,instagram WHY CANT I SEE MY POSTS ONE BY ONE ANYMORE https //t.co/WUEyPgaaa3,0.0
1144017143425654784,Wed Jun 26 22:58:36 +0000 2019,Reminder that until the end of the month you can get Life of Melody and any other merch from hivemill for 10% off!… https://t.co/p8IXIOg95d,Reminder end month get Life Melody merch hivemill 10 … https //t.co/p8IXIOg95d,0.0
1144006328362459136,Wed Jun 26 22:15:37 +0000 2019,@bvcketdraws i think the prefs are finally updating but ty!!,bvcketdraws think prefs finally updating ty,0.0
1144003795933904896,Wed Jun 26 22:05:34 +0000 2019,pls help im panicking just a little,pls help im panicking little,-0.1875
1144003463766036483,Wed Jun 26 22:04:14 +0000 2019,hey has anyone who updated csp had issues with the “copy user settings” thing taking a rly long time to load? shoul… https://t.co/0LShT77MzK,hey anyone updated csp issues “ copy user settings ” thing taking rly long time load shoul… https //t.co/0LShT77MzK,-0.05
1143991560452870146,Wed Jun 26 21:16:57 +0000 2019,"thanks, Brand",thanks Brand,0.2
1143991422892281856,Wed Jun 26 21:16:24 +0000 2019,my birthday is in 2 weeks and i know this because asos told me,birthday 2 weeks know asos told,0.0
1143938421494341632,Wed Jun 26 17:45:47 +0000 2019,"""should i hide the fact that i referenced doug dimmadome for cowboy aziraphale even a little?"" no",`` hide fact referenced doug dimmadome cowboy aziraphale even little '',-0.1875
1143938066949824512,Wed Jun 26 17:44:23 +0000 2019,.@xoxobouma drew cowboy crowley and i was Possessed to draw this https://t.co/buvMIxZkh6,xoxobouma drew cowboy crowley Possessed draw https //t.co/buvMIxZkh6,0.0
1143931363088916481,Wed Jun 26 17:17:44 +0000 2019,@xoxobouma thank u xantheee!,xoxobouma thank u xantheee,0.0
1143926073459191812,Wed Jun 26 16:56:43 +0000 2019,snake joke 2 https://t.co/m6XI8EP9Zk,snake joke 2 https //t.co/m6XI8EP9Zk,0.0
1143922200812109827,Wed Jun 26 16:41:20 +0000 2019,picnic... https://t.co/sgONrgwN6O,picnic ... https //t.co/sgONrgwN6O,0.0
1143912277294440450,Wed Jun 26 16:01:54 +0000 2019,"i honest to god dont mind paying VAT. its whatever. im importing something, so let me have the import fees. But i r… https://t.co/aSchw5v9QX",honest god dont mind paying VAT whatever im importing something let import fees But r… https //t.co/aSchw5v9QX,0.6
1143911632353017856,Wed Jun 26 15:59:20 +0000 2019,"hey this is a serious question is there any legislation movement in europe to like.... curb ""handling fees"" on inte… https://t.co/VxuSqJvwjg",hey serious question legislation movement europe like ... curb `` handling fees '' inte… https //t.co/VxuSqJvwjg,-0.3333333333333333
1143863883897217026,Wed Jun 26 12:49:36 +0000 2019,why does les mills (tm) want me to break both my legs so badly this summer,les mills tm want break legs badly summer,-0.6999999999999998
1143777791890141184,Wed Jun 26 07:07:30 +0000 2019,im sorry for my bad taste some crimes cant be forgiven etc (and then there were none is still a huge bop tho)… https://t.co/U8JvmQHvJI,im sorry bad taste crimes cant forgiven etc none still huge bop tho … https //t.co/U8JvmQHvJI,-0.26666666666666655
1143625040224837632,Tue Jun 25 21:00:31 +0000 2019,@Funeral_Biscuit i understand,Funeral_Biscuit understand,0.0
1143624773446119425,Tue Jun 25 20:59:28 +0000 2019,@Funeral_Biscuit ive never watched sailor moon in my life but i do want this,Funeral_Biscuit ive never watched sailor moon life want,0.0
1143607772438835207,Tue Jun 25 19:51:54 +0000 2019,neil gaiman please confirm my headcanon that crowley retains the anatomy of a snake even as a human https://t.co/G3NLMjRoEK,neil gaiman please confirm headcanon crowley retains anatomy snake even human https //t.co/G3NLMjRoEK,0.0
1143597525104058368,Tue Jun 25 19:11:11 +0000 2019,long time no frince https://t.co/5pFpDtYPb0,long time frince https //t.co/5pFpDtYPb0,-0.05
1143512643904376833,Tue Jun 25 13:33:54 +0000 2019,@niedoliski yea its ray pidograph 4 from the frenden brush set,niedoliski yea ray pidograph 4 frenden brush set,0.0
1143496689803771909,Tue Jun 25 12:30:30 +0000 2019,If you were looking to get yourself a copy of Life of Melody now’s your chance! https://t.co/wZf3jryNVM https://t.co/M7B7HTLqMV,If looking get copy Life Melody ’ chance https //t.co/wZf3jryNVM https //t.co/M7B7HTLqMV,0.0
1143459930214735872,Tue Jun 25 10:04:26 +0000 2019,@Alucard3598 oh its good omens!,Alucard3598 oh good omens,0.7
1143457430224932864,Tue Jun 25 09:54:30 +0000 2019,important,important,0.4
1143456929848709120,Tue Jun 25 09:52:31 +0000 2019,i have this brush i like for doodling that i havent used in a rly long time but heres a howls moving castle au w ocs https://t.co/boClhmClem,brush like doodling havent used rly long time heres howls moving castle au w ocs https //t.co/boClhmClem,-0.05
1143251123136077824,Mon Jun 24 20:14:42 +0000 2019,snake joke https://t.co/VGmuaHf9mE,snake joke https //t.co/VGmuaHf9mE,0.0
1143236526962356224,Mon Jun 24 19:16:42 +0000 2019,@bvcketdraws just 4 u,bvcketdraws 4 u,0.0
1143224801756098561,Mon Jun 24 18:30:07 +0000 2019,observably crowley and aziraphale fanart falls within a spectrum of these two design senses https://t.co/tf0gTB2yur,observably crowley aziraphale fanart falls within spectrum two design senses https //t.co/tf0gTB2yur,0.0
1143164676345401344,Mon Jun 24 14:31:12 +0000 2019,8 YEARS AND THEYRE STILL IN LOVE!!!!!!!!!!!!!!!!!!!!!!!!!!!,8 YEARS AND THEYRE STILL IN LOVE,0.5
1143163949724184576,Mon Jun 24 14:28:19 +0000 2019,lol 2011 good omens art vs this morning https://t.co/ByGNVbRU5J,lol 2011 good omens art vs morning https //t.co/ByGNVbRU5J,0.75
1143154360903487488,Mon Jun 24 13:50:13 +0000 2019,@Alucard3598 mostly the bit that says angels dont groom themselves as well but also the fact that aziraphale lives… https://t.co/mrVjlIPRtg,Alucard3598 mostly bit says angels dont groom well also fact aziraphale lives… https //t.co/mrVjlIPRtg,0.5
1143122222661427200,Mon Jun 24 11:42:30 +0000 2019,tumblr knows aziraphales dick is out in this image and its huge https://t.co/l6g8ZcNwsw,tumblr knows aziraphales dick image huge https //t.co/l6g8ZcNwsw,0.4000000000000001
1143087075274739712,Mon Jun 24 09:22:50 +0000 2019,i know aziraphale presents himself very properly in the tv show but for some reason when i read the books i always… https://t.co/MFiPbsW4pv,know aziraphale presents properly tv show reason read books always… https //t.co/MFiPbsW4pv,0.0
1142918787622211584,Sun Jun 23 22:14:08 +0000 2019,@beverlylove omg i Just ordered these. they have more sizes on the lazy oaf website,beverlylove omg Just ordered sizes lazy oaf website,-0.25
1142915504325218304,Sun Jun 23 22:01:05 +0000 2019,watched castle of cagliostro again and its still very cute and good,watched castle cagliostro still cute good,0.6
1142876479509925888,Sun Jun 23 19:26:00 +0000 2019,@arythusa hi! i do mostly pure fantasy settings in my work but i can definitely steer into more modern stuff as wel… https://t.co/xpBEeaOin8,arythusa hi mostly pure fantasy settings work definitely steer modern stuff wel… https //t.co/xpBEeaOin8,0.13809523809523808
1142856386788888578,Sun Jun 23 18:06:10 +0000 2019,@kadeart OMG thank you!!! 😳😳,kadeart OMG thank 😳😳,0.0
1142849007707926528,Sun Jun 23 17:36:51 +0000 2019,man i watched the new aggretsuko season and i couldnt concentrate on the back half of it because i kept waiting for… https://t.co/yi1l3N47XU,man watched new aggretsuko season couldnt concentrate back half kept waiting for… https //t.co/yi1l3N47XU,-0.010101010101010102
1142805438502711296,Sun Jun 23 14:43:43 +0000 2019,@6ftbutch i wanna but its not on netflix!!!!!,6ftbutch wan na netflix,-0.2
1142787028473589760,Sun Jun 23 13:30:34 +0000 2019,@6ftbutch i need to watch itttt,6ftbutch need watch itttt,0.0
1142708270680989696,Sun Jun 23 08:17:36 +0000 2019,"list of my ocs who are morosexual
-ligia
-bon
-hydrangea and qing simultaneously",list ocs morosexual -ligia -bon -hydrangea qing simultaneously,0.0
1142707399746347008,Sun Jun 23 08:14:09 +0000 2019,i got asked how dagmar even has a girlfriend yesterday and i thought about it and the honest canonical reason is ligia is a morosexual,got asked dagmar even girlfriend yesterday thought honest canonical reason ligia morosexual,0.6
1142340258459267073,Sat Jun 22 07:55:15 +0000 2019,hey twitter i really feel like i dont Need to see people i follow’s replies to people who i dont follow. feels like… https://t.co/qFSQD95oAz,hey twitter really feel like dont Need see people follow ’ replies people dont follow feels like… https //t.co/qFSQD95oAz,0.2
1141826323557564417,Thu Jun 20 21:53:04 +0000 2019,@enenkay the uniform is soooo cute omg,enenkay uniform soooo cute omg,0.5
1141817837918535687,Thu Jun 20 21:19:21 +0000 2019,tiny shrine https://t.co/5Qo62yVBoo,tiny shrine https //t.co/5Qo62yVBoo,0.0
1141816223342182400,Thu Jun 20 21:12:56 +0000 2019,donald success https://t.co/fOSt3zVZEB,donald success https //t.co/fOSt3zVZEB,0.3
1141779141483749378,Thu Jun 20 18:45:35 +0000 2019,@hattersarts oh my goddddd the mood,hattersarts oh goddddd mood,0.0
1141775668289724418,Thu Jun 20 18:31:47 +0000 2019,@rookiebe @charmwitch i did : ( i got paperlike and it didnt help at all im p sure the problem is the nib of the pe… https://t.co/IzPoPqUIdw,rookiebe charmwitch got paperlike didnt help im p sure problem nib pe… https //t.co/IzPoPqUIdw,0.5
1141774876149243904,Thu Jun 20 18:28:38 +0000 2019,@charmwitch i do own an ipad but i cannnnt stand how the pen feels... its like drawing on glass i cant work with it… https://t.co/mNq7cAkFYu,charmwitch ipad cannnnt stand pen feels ... like drawing glass cant work it… https //t.co/mNq7cAkFYu,0.0
1141771405379461124,Thu Jun 20 18:14:50 +0000 2019,@MsRocketGrealy film?,MsRocketGrealy film,0.0
1141769955987341312,Thu Jun 20 18:09:05 +0000 2019,"for the record, i have never in my life used the side buttons on the 13hd so the pro 13 not having them isnt a deal… https://t.co/KLPKNMqHmS",record never life used side buttons 13hd pro 13 isnt deal… https //t.co/KLPKNMqHmS,0.0
1141768504045166592,Thu Jun 20 18:03:19 +0000 2019,also share this if you can! i just got my first Big Boy Job that i have to begin work on very soon and i'd like to… https://t.co/ChnQkNmccJ,also share got first Big Boy Job begin work soon 'd like to… https //t.co/ChnQkNmccJ,0.125
1141767558250618880,Thu Jun 20 17:59:33 +0000 2019,it has to be the 13 and not the new cheaper 16 model because anything bigger means i cant travel with it! and i tra… https://t.co/dN7YYubnlA,13 new cheaper 16 model anything bigger means cant travel tra… https //t.co/dN7YYubnlA,0.06818181818181818
1141767339920281603,Thu Jun 20 17:58:41 +0000 2019,hey guys!! sad news but my cintiq13hd had some trouble during my trip and ended up with a big scratch that makes it… https://t.co/v77W3fs62n,hey guys sad news cintiq13hd trouble trip ended big scratch makes it… https //t.co/v77W3fs62n,-0.2333333333333333
1141722324732981248,Thu Jun 20 14:59:49 +0000 2019,@gchoule i def didnt mean every comic needs to have perfect design i think when i say good lettering my standards a… https://t.co/LdLtmHbmcf,gchoule def didnt mean every comic needs perfect design think say good lettering standards a… https //t.co/LdLtmHbmcf,0.409375
1141712003591004161,Thu Jun 20 14:18:48 +0000 2019,@CandyladyArt i know i make tweets like this a lot but i really dont have That high standards for lettering! i thin… https://t.co/sWBAdu4r6W,CandyladyArt know make tweets like lot really dont That high standards lettering thin… https //t.co/sWBAdu4r6W,0.18
1141703359021375488,Thu Jun 20 13:44:27 +0000 2019,anyway i refuse to read comics with bad lettering no matter how good the art. if you dont care about your story eno… https://t.co/yMyp905dEp,anyway refuse read comics bad lettering matter good art dont care story eno… https //t.co/yMyp905dEp,5.551115123125783e-17
1141702608182284288,Thu Jun 20 13:41:28 +0000 2019,"please im begging comic artists to care about your lettering, its just as much part of the page as the “art”. its l… https://t.co/LLw91vt3CM",please im begging comic artists care lettering much part page “ art ” l… https //t.co/LLw91vt3CM,0.225
1141428962452803584,Wed Jun 19 19:34:06 +0000 2019,@hattersarts crowley didnt stay on a burning dying earth in his burning dying car instead of peacing out into space… https://t.co/uXv2xVDUYf,hattersarts crowley didnt stay burning dying earth burning dying car instead peacing space… https //t.co/uXv2xVDUYf,0.0
1141427966125195264,Wed Jun 19 19:30:08 +0000 2019,real fandom hours is just saw someone sort aziraphale and crowley as hufflepuff and slytherin respectively and flew into a rage,real fandom hours saw someone sort aziraphale crowley hufflepuff slytherin respectively flew rage,0.1
1141244097119883264,Wed Jun 19 07:19:30 +0000 2019,i went to eurodisney and the wildest thing i saw was a toy of the fork from the new toy story movie.... bruh... you… https://t.co/LRFUoBnBSH,went eurodisney wildest thing saw toy fork new toy story movie ... bruh ... you… https //t.co/LRFUoBnBSH,0.13636363636363635
1141097820797198337,Tue Jun 18 21:38:15 +0000 2019,i went into a fugue state and drew this two weeks ago and then completely forgot about it https://t.co/TpA0Te8PHv,went fugue state drew two weeks ago completely forgot https //t.co/TpA0Te8PHv,0.1
1140912355708198913,Tue Jun 18 09:21:17 +0000 2019,@enenkay i Love them,enenkay Love,0.5
1140897254775152640,Tue Jun 18 08:21:17 +0000 2019,@enenkay his heels...,enenkay heels ...,0.0
1140323579315335168,Sun Jun 16 18:21:42 +0000 2019,@6ftbutch holy shit,6ftbutch holy shit,-0.2
1139856506503827456,Sat Jun 15 11:25:43 +0000 2019,i know theres gonna be crowley and aziraphale f*nko pops but if i dont see any nendos i’ll riot,know theres gon na crowley aziraphale f*nko pops dont see nendos ’ riot,0.0
1139258419125186560,Thu Jun 13 19:49:08 +0000 2019,@HonestlyJon omg im cry....,HonestlyJon omg im cry ...,0.0
1139248002189680642,Thu Jun 13 19:07:44 +0000 2019,@Dihuh as someone named mariana i understand this,Dihuh someone named mariana understand,0.0
1139212416624005120,Thu Jun 13 16:46:20 +0000 2019,https://t.co/3gr0tCNa48 turns 4 today!! thanks for reading! you can get this piece as a print right here!… https://t.co/baJZMJ9GKQ,https //t.co/3gr0tCNa48 turns 4 today thanks reading get piece print right … https //t.co/baJZMJ9GKQ,0.24285714285714285
1139112650472923137,Thu Jun 13 10:09:54 +0000 2019,bringing this short hair zelda i drew back lol https://t.co/PyUTKqWBKi,bringing short hair zelda drew back lol https //t.co/PyUTKqWBKi,0.26666666666666666
1139101350799773697,Thu Jun 13 09:25:00 +0000 2019,annecy https://t.co/FLFGovbBoE,annecy https //t.co/FLFGovbBoE,0.0
1139062130194255872,Thu Jun 13 06:49:09 +0000 2019,@boodlebrain its true and you should say it link n zelda look too related,boodlebrain true say link n zelda look related,0.175
1139061854276325376,Thu Jun 13 06:48:03 +0000 2019,its peritale birthday,peritale birthday,0.0
1138372333020823553,Tue Jun 11 09:08:08 +0000 2019,“theyre not gay because they dont have a set gender” cast women or nb ppl to play them then coward,“ theyre gay dont set gender ” cast women nb ppl play coward,0.4166666666666667
1138176717607067650,Mon Jun 10 20:10:50 +0000 2019,@dreadwyrmtrance UGH BLUE!!!! WELCOME BACK!!!!!,dreadwyrmtrance UGH BLUE WELCOME BACK,0.26666666666666666
1138145544805769219,Mon Jun 10 18:06:58 +0000 2019,as mentioned on my handle i’ll be attending annecy until friday! but i will also be taking the opportunity to visit… https://t.co/2ONsgpvbHc,mentioned handle ’ attending annecy friday also taking opportunity visit… https //t.co/2ONsgpvbHc,0.0
1137652226527285248,Sun Jun 09 09:26:42 +0000 2019,@paranaturalzack this is actually my new oc their name is frog prince 2 https://t.co/x9nbholfhC,paranaturalzack actually new oc name frog prince 2 https //t.co/x9nbholfhC,0.13636363636363635
1137650593936412672,Sun Jun 09 09:20:12 +0000 2019,"im not in the business of calling anyone out publicly or raining on anyones parade, but please consider this design… https://t.co/GUc492bGTP",im business calling anyone publicly raining anyones parade please consider design… https //t.co/GUc492bGTP,-0.125
1137650255837769728,Sun Jun 09 09:18:52 +0000 2019,its made me a little uncomfortable the past few weeks how many frog prince “clones” have sprung up around the inter… https://t.co/Ec9L1VeU9q,made little uncomfortable past weeks many frog prince “ clones ” sprung around inter… https //t.co/Ec9L1VeU9q,-0.109375
1137648105086734339,Sun Jun 09 09:10:19 +0000 2019,to answer a faq https://t.co/cNAoXMJZqo,answer faq https //t.co/cNAoXMJZqo,0.0
1137612238712426496,Sun Jun 09 06:47:48 +0000 2019,@mishacak3s i mean we could discuss all day which crj songs are otp material and another correct answer is cut to the feeling,mishacak3s mean could discuss day crj songs otp material another correct answer cut feeling,-0.3125
1137610989392859136,Sun Jun 09 06:42:50 +0000 2019,anyone else think abt crowley asking aziraphale to move to alpha centauri with him and immediately hear the horn no… https://t.co/eaeXNxGGZH,anyone else think abt crowley asking aziraphale move alpha centauri immediately hear horn no… https //t.co/eaeXNxGGZH,0.0
1137578478675664896,Sun Jun 09 04:33:39 +0000 2019,@miyuliart wahh thank u!!,miyuliart wahh thank u,0.0
1137439495215898624,Sat Jun 08 19:21:22 +0000 2019,@kikuhughes Y i k e s,kikuhughes Y k e,0.0
1137438204263587840,Sat Jun 08 19:16:15 +0000 2019,@kikuhughes what..... is man eaters....,kikuhughes ... .. man eaters ...,0.0
1137259249711624192,Sat Jun 08 07:25:09 +0000 2019,black mirror deadass thought the appeal of hatsune miku is that shes holographic and not that shes an anime girl,black mirror deadass thought appeal hatsune miku shes holographic shes anime girl,-0.16666666666666666
1137257731503611904,Sat Jun 08 07:19:07 +0000 2019,(lying down) im 14 and i just joined tumblr dot com and crowley and aziraphale are in love,lying im 14 joined tumblr dot com crowley aziraphale love,0.5
1137087578790871040,Fri Jun 07 20:02:59 +0000 2019,stupid https://t.co/PZMb5XnmuS,stupid https //t.co/PZMb5XnmuS,-0.7999999999999999
1137075299487813632,Fri Jun 07 19:14:11 +0000 2019,crowley drives a volkswagen beetle,crowley drives volkswagen beetle,0.0
1137073683791585285,Fri Jun 07 19:07:46 +0000 2019,when i was like 16 or whatever i drew a good omens au where the roles were swapped and i wanted to redraw it... https://t.co/t5NAbvtJUO,like 16 whatever drew good omens au roles swapped wanted redraw ... https //t.co/t5NAbvtJUO,0.7
1137063985642184705,Fri Jun 07 18:29:14 +0000 2019,heres these too... i wanna redraw them someday https://t.co/rYIrCF6r2S,heres ... wan na redraw someday https //t.co/rYIrCF6r2S,-0.2
1137056631437611009,Fri Jun 07 18:00:01 +0000 2019,got a lil nostalgic and when through my old good omens art and found This lol https://t.co/iZODdRaRR8,got lil nostalgic old good omens art found This lol https //t.co/iZODdRaRR8,0.275
1137030936720285697,Fri Jun 07 16:17:54 +0000 2019,the first ep of new black mirror is literally the funniest shit ive ever seen but also dont watch it if ur allergic… https://t.co/8PFB0JIQjz,first ep new black mirror literally funniest shit ive ever seen also dont watch ur allergic… https //t.co/8PFB0JIQjz,0.004924242424242421
1137021222640861184,Fri Jun 07 15:39:18 +0000 2019,@boodlebrain ugh this is super relatable... esp the weight loss not fixing things im rly feeling that rn!!! 😞,boodlebrain ugh super relatable ... esp weight loss fixing things im rly feeling rn 😞,0.3333333333333333
1136916589939478528,Fri Jun 07 08:43:32 +0000 2019,@hattersarts homestuck,hattersarts homestuck,0.0
1136735175184924673,Thu Jun 06 20:42:39 +0000 2019,make him the cutest that ive ever sailed https://t.co/oEvV85yNiT,make cutest ive ever sailed https //t.co/oEvV85yNiT,0.0
1136679625193660418,Thu Jun 06 17:01:55 +0000 2019,@drifterdrabbles yea with hiveworks!,drifterdrabbles yea hiveworks,0.0
1136677206657314816,Thu Jun 06 16:52:19 +0000 2019,i still really like today’s https://t.co/3gr0tCNa48 page even though I drew it a while ago haha https://t.co/qGd5xgmohW,still really like today ’ https //t.co/3gr0tCNa48 page even though I drew ago haha https //t.co/qGd5xgmohW,0.2
1136674225799028738,Thu Jun 06 16:40:28 +0000 2019,@PeteKRyan oh hey me too!,PeteKRyan oh hey,0.0
1136643870018736129,Thu Jun 06 14:39:51 +0000 2019,one of my fav things is drawing ship kids lol.... https://t.co/jKTwxprRfB,one fav things drawing ship kids lol ... https //t.co/jKTwxprRfB,0.8
1136624316597116929,Thu Jun 06 13:22:09 +0000 2019,LET ME IN!!!! https://t.co/dUb1vpxjUs,LET ME IN https //t.co/dUb1vpxjUs,0.0
1136510868861181952,Thu Jun 06 05:51:21 +0000 2019,good omens was really fun,good omens really fun,0.5
1135625091742666756,Mon Jun 03 19:11:35 +0000 2019,(ursula voice) it wont cost much... just your BOYS!!,ursula voice wont cost much ... BOYS,0.2
1135616336711884800,Mon Jun 03 18:36:48 +0000 2019,@bvcketdraws congwats!!!!!,bvcketdraws congwats,0.0
1135589983723687936,Mon Jun 03 16:52:05 +0000 2019,@thedrawingduke OMG BEKA ur already so powerful im so in awe of ur art!!!!,thedrawingduke OMG BEKA ur already powerful im awe ur art,0.3
1135589349943328768,Mon Jun 03 16:49:33 +0000 2019,@thedrawingduke WHOA CONGRATS BEKA!!!!!,thedrawingduke WHOA CONGRATS BEKA,0.0
1135586753883070464,Mon Jun 03 16:39:14 +0000 2019,people going through my 6 year old good omens art on tumblr: i’ll cry,people going 6 year old good omens art tumblr ’ cry,0.39999999999999997
1135585876262760451,Mon Jun 03 16:35:45 +0000 2019,@Da_Supercrafter oh! its not a comic its just some illustrations i do,Da_Supercrafter oh comic illustrations,0.25
1135582676470157313,Mon Jun 03 16:23:02 +0000 2019,(eating discount cherries out of the box) six million dollar evaluation? they better have good profit margins!!!,eating discount cherries box six million dollar evaluation better good profit margins,0.6
1135582407447535617,Mon Jun 03 16:21:58 +0000 2019,if you ever find yourself wanting to be better at maths just pop on a few episodes of shark tank and marvel at how… https://t.co/26OPvkGSVP,ever find wanting better maths pop episodes shark tank marvel how… https //t.co/26OPvkGSVP,0.5
1135581190453366787,Mon Jun 03 16:17:08 +0000 2019,@Da_Supercrafter ? i drew this,Da_Supercrafter drew,0.0
