id,created_at,original_text,clean_text,polarity
1099736944089677824,Sun Feb 24 18:24:54 +0000 2019,@boobbiggie BIG STAN OF THIS,boobbiggie BIG STAN OF THIS,0.0
1099562651422769158,Sun Feb 24 06:52:19 +0000 2019,@CutTimeComic hatsune mike,CutTimeComic hatsune mike,0.0
1099422997801259008,Sat Feb 23 21:37:23 +0000 2019,"@mickequ when u have multiple layers for inks, details etc u can turn that on and have colourfill on as many differ… https://t.co/ms5Tv0we8T",mickequ u multiple layers inks details etc u turn colourfill many differ… https //t.co/ms5Tv0we8T,0.25
1099420105778311168,Sat Feb 23 21:25:54 +0000 2019,@mickequ this https://t.co/RC3YR8MF6d,mickequ https //t.co/RC3YR8MF6d,0.0
1099409596748320768,Sat Feb 23 20:44:08 +0000 2019,@Cygulls thank u kay!,Cygulls thank u kay,0.0
1099272584225587200,Sat Feb 23 11:39:42 +0000 2019,@citrusants omg can... i see it? im always looking for bg noise to listen to,citrusants omg ... see im always looking bg noise listen,0.0
1099253719928111106,Sat Feb 23 10:24:44 +0000 2019,just the exact intonation of how he says “no!” from the delta airlines bit https://t.co/14pVTLlGXm,exact intonation says “ ” delta airlines bit https //t.co/14pVTLlGXm,0.25
1099240537310355456,Sat Feb 23 09:32:21 +0000 2019,@rudebeetle i loooove this piece so much,rudebeetle loooove piece much,0.2
1099078397370748928,Fri Feb 22 22:48:04 +0000 2019,@paranaturalzack whoa congrats!!,paranaturalzack whoa congrats,0.0
1099043701526069249,Fri Feb 22 20:30:12 +0000 2019,thank you! actually been planning a comic with them for a while now! im in the thumbnailing phase https://t.co/5y8bueZtLx,thank actually planning comic im thumbnailing phase https //t.co/5y8bueZtLx,0.125
1099027303680626688,Fri Feb 22 19:25:02 +0000 2019,one more draw this in your style! this one is @dokirosi's char! https://t.co/Amv70Bm0HO,one draw style one dokirosi 's char https //t.co/Amv70Bm0HO,0.0
1099007995487440903,Fri Feb 22 18:08:19 +0000 2019,warmup of @beverlylove 's draw this in your style https://t.co/jEePde4mQ6,warmup beverlylove 's draw style https //t.co/jEePde4mQ6,0.0
1098896972193431553,Fri Feb 22 10:47:09 +0000 2019,or like. yknow. ppl im actually familiar with. figured that was implied,like yknow ppl im actually familiar figured implied,0.375
1098896807369818112,Fri Feb 22 10:46:30 +0000 2019,mutuals only Pwease,mutuals Pwease,0.0
1098892581763760128,Fri Feb 22 10:29:42 +0000 2019,is anyone going to apply to mcm london and wants to do splitsies on a table,anyone going apply mcm london wants splitsies table,0.2
1098831368249843713,Fri Feb 22 06:26:28 +0000 2019,@irukasango whoa congrats!!!,irukasango whoa congrats,0.0
1098663288269955073,Thu Feb 21 19:18:34 +0000 2019,@bellicapax omg thank u for ur purchase they look rad on you!!,bellicapax omg thank u ur purchase look rad,0.0
1098637034397356032,Thu Feb 21 17:34:15 +0000 2019,thank u for ur kind words.... now that ive made it to print comics my ego knows no bounds....,thank u ur kind words ... ive made print comics ego knows bounds ...,0.6
1098488220717928449,Thu Feb 21 07:42:55 +0000 2019,@TheGreenDudeAMV im talking about if someone promises you a certain amount of money (never go into a job without kn… https://t.co/hXxXHRDQnT,TheGreenDudeAMV im talking someone promises certain amount money never go job without kn… https //t.co/hXxXHRDQnT,0.21428571428571427
1098483065406541825,Thu Feb 21 07:22:26 +0000 2019,also when i say “nobody wants to pay you” i dont mean it like “nobody thinks your work is worth something” i mean i… https://t.co/jGlL4yeQ5A,also say “ nobody wants pay ” dont mean like “ nobody thinks work worth something ” mean i… https //t.co/jGlL4yeQ5A,-0.03125
1098482381336576000,Thu Feb 21 07:19:43 +0000 2019,"hello children its your aunt mari with some wisdom:
nobody hiring in the art industry Really wants to pay you for y… https://t.co/K1LFOf93aj",hello children aunt mari wisdom nobody hiring art industry Really wants pay y… https //t.co/K1LFOf93aj,0.2
1098322479997685764,Wed Feb 20 20:44:19 +0000 2019,lrt.. its true... very excited to be writing a story for lumberjanes!,lrt.. true ... excited writing story lumberjanes,0.3625
1097953027019943937,Tue Feb 19 20:16:15 +0000 2019,@rah_ciach i will never let go of tvpaint but i want tvpaint with clip studio quality brushes,rah_ciach never let go tvpaint want tvpaint clip studio quality brushes,0.0
1097881568150986752,Tue Feb 19 15:32:18 +0000 2019,"@bmacconnell1 youre right, i drew peach’s outfit off the dome and not even once googled what a shinto wedding kimono looked like. you got me",bmacconnell1 youre right drew peach ’ outfit dome even googled shinto wedding kimono looked like got,0.2857142857142857
1097873454563557382,Tue Feb 19 15:00:03 +0000 2019,"@hattersarts yea and like, facial! i rly like how u draw faces",hattersarts yea like facial rly like u draw faces,0.0
1097864921646358528,Tue Feb 19 14:26:09 +0000 2019,@hattersarts construction n rendering!,hattersarts construction n rendering,0.0
1097819394430902272,Tue Feb 19 11:25:14 +0000 2019,shinto wedding... https://t.co/kKosJiGIdI,shinto wedding ... https //t.co/kKosJiGIdI,0.0
1097757818936020992,Tue Feb 19 07:20:34 +0000 2019,@mickequ interesting.............,mickequ interesting ... ... ... ...,0.5
1097613544693080064,Mon Feb 18 21:47:16 +0000 2019,@alexisparade if u skip artvsartist u can clip right thru visiblewomen,alexisparade u skip artvsartist u clip right thru visiblewomen,0.2857142857142857
1097570968648728576,Mon Feb 18 18:58:05 +0000 2019,"Hi, #VisibleWomen! I'm Mari, a luso-brazilian cartoonist and 2d animator and the author of https://t.co/3gr0tCNa48… https://t.co/ZbFnRu0Sxl",Hi VisibleWomen I 'm Mari luso-brazilian cartoonist 2d animator author https //t.co/3gr0tCNa48… https //t.co/ZbFnRu0Sxl,0.0
1097563120422322177,Mon Feb 18 18:26:54 +0000 2019,another call to once again pls follow me on instagram https://t.co/ImxI77pkeK,another call pls follow instagram https //t.co/ImxI77pkeK,0.0
1097246599263277057,Sun Feb 17 21:29:09 +0000 2019,@raiderman94 im not the bowuigi guy lol,raiderman94 im bowuigi guy lol,0.8
1097245996881494017,Sun Feb 17 21:26:46 +0000 2019,i just think theyre neat https://t.co/13VmSL5U0M,think theyre neat https //t.co/13VmSL5U0M,0.0
1097173607090999296,Sun Feb 17 16:39:07 +0000 2019,ill be your one up girl https://t.co/gpHNdgXc0d,ill one girl https //t.co/gpHNdgXc0d,-0.5
1096753598283870209,Sat Feb 16 12:50:09 +0000 2019,MY COPY OF THE THAT BUT LESBIANS ZINE ARRIVED!!! thank u so much @hattersarts for putting it together!!! it looks g… https://t.co/iJDZLANKpZ,MY COPY OF THE THAT BUT LESBIANS ZINE ARRIVED thank u much hattersarts putting together looks g… https //t.co/iJDZLANKpZ,0.2
1096478732838232064,Fri Feb 15 18:37:56 +0000 2019,animating in clip studio paint is like going back to pencil and paper animation all over again because the player i… https://t.co/MfXBieUb15,animating clip studio paint like going back pencil paper animation player i… https //t.co/MfXBieUb15,0.0
1096477718709981185,Fri Feb 15 18:33:54 +0000 2019,@EiffelArt reference what reference???,EiffelArt reference reference,0.0
1096477325921865728,Fri Feb 15 18:32:20 +0000 2019,run cycles are hard...,run cycles hard ...,-0.2916666666666667
1096477214638592001,Fri Feb 15 18:31:54 +0000 2019,"watch out, link!! https://t.co/BZZFk2zAoV",watch link https //t.co/BZZFk2zAoV,0.0
1096404627325702144,Fri Feb 15 13:43:28 +0000 2019,im finally playing the hot new videogame on everyones minds.... mario odyssey,im finally playing hot new videogame everyones minds ... mario odyssey,0.12878787878787878
1096174255207825409,Thu Feb 14 22:28:03 +0000 2019,dont forget to rt these!!,dont forget rt,0.0
1096158403414642691,Thu Feb 14 21:25:03 +0000 2019,"✨THEYRE HERE!!✨

Just in time for valentine's day, the long awaited Sun/Moon lesbian pins are here! Get them for yo… https://t.co/SdWE9q6Fao",✨THEYRE HERE ✨ Just time valentine 's day long awaited Sun/Moon lesbian pins Get yo… https //t.co/SdWE9q6Fao,-0.05
1096128861945954305,Thu Feb 14 19:27:40 +0000 2019,@mickequ god youre right,mickequ god youre right,0.2857142857142857
1096127013096689666,Thu Feb 14 19:20:19 +0000 2019,valentimes... is a time for fighting. who is ur favourite peritale ship,valentimes ... time fighting ur favourite peritale ship,0.0
1096126227285303296,Thu Feb 14 19:17:12 +0000 2019,sshine is doing a sale please go read the comic me n sloan- i mean uhhh some anonymous benefactors made https://t.co/DMNritxUnD,sshine sale please go read comic n sloan- mean uhhh anonymous benefactors made https //t.co/DMNritxUnD,-0.03125
1096123305134907392,Thu Feb 14 19:05:35 +0000 2019,@stripeyworm @ZapCreatives wahhh kristina theyre so cute!!!!!,stripeyworm ZapCreatives wahhh kristina theyre cute,0.5
1096117510661910528,Thu Feb 14 18:42:34 +0000 2019,Put together a step by step process of my last little animation! https://t.co/taRCDjnx8Y,Put together step step process last little animation https //t.co/taRCDjnx8Y,-0.09375
1095818178628894720,Wed Feb 13 22:53:07 +0000 2019,when you shake the wiimote and mario do a twirl...... feel good,shake wiimote mario twirl ... ... feel good,0.7
1095818085645340672,Wed Feb 13 22:52:45 +0000 2019,im playing super mario odyssey and its fun but for the most part im like god i wish i was playing mario galaxy right now,im playing super mario odyssey fun part im like god wish playing mario galaxy right,0.3063492063492063
1095817860729966592,Wed Feb 13 22:51:51 +0000 2019,(gets down on my hands and knees) nintendo please port mario galaxy to the switch my children are starving,gets hands knees nintendo please port mario galaxy switch children starving,0.0
1095817555648933888,Wed Feb 13 22:50:39 +0000 2019,@Teiknu you have to fight alex for it its out of my control,Teiknu fight alex control,0.0
1095811538831753217,Wed Feb 13 22:26:44 +0000 2019,@Teiknu if you kill me and eat my heart you become ngo director,Teiknu kill eat heart become ngo director,0.0
1095769486857330688,Wed Feb 13 19:39:38 +0000 2019,for the next 5 to 6 business days i do not have a passport... this is your chance.... i am at my weakest..... come and harm me,next 5 6 business days passport ... chance ... weakest ... .. come harm,0.0
1095760872012689409,Wed Feb 13 19:05:24 +0000 2019,wait frozone 2 comes out THIS YEAR?,wait frozone 2 comes THIS YEAR,0.0
1095754122891091968,Wed Feb 13 18:38:35 +0000 2019,i found her.... bethany esda... https://t.co/S8NGGpzggn,found ... bethany esda ... https //t.co/S8NGGpzggn,0.0
1095365456519667713,Tue Feb 12 16:54:10 +0000 2019,@mangalheiro weve all seen steven universe mango,mangalheiro weve seen steven universe mango,0.0
1095272441859981312,Tue Feb 12 10:44:33 +0000 2019,@spacecommulist thank you so much!!☺️,spacecommulist thank much ☺️,0.2
1095251373929709569,Tue Feb 12 09:20:50 +0000 2019,its for a good cause think of the children (me),good cause think children,0.7
1095251088406708224,Tue Feb 12 09:19:42 +0000 2019,gofundme to send a playstation 4 and a tv to my dorm so i can play kingdom hearts,gofundme send playstation 4 tv dorm play kingdom hearts,0.0
1095216331257974784,Tue Feb 12 07:01:36 +0000 2019,@charmwitch ohh happy birthday angie!! hope u had a great one!! ✨✨✨,charmwitch ohh happy birthday angie hope u great one ✨✨✨,0.8
1095215825051631616,Tue Feb 12 06:59:35 +0000 2019,"kickstarter rewards should go out early next week, so everything should be available for purchase soon after that! https://t.co/sqQy8dHiya",kickstarter rewards go early next week everything available purchase soon https //t.co/sqQy8dHiya,0.16666666666666666
1095052171131961345,Mon Feb 11 20:09:17 +0000 2019,actually no please dont think i go to animation school then youll say i should know better about how sloppy those arcs are,actually please dont think go animation school youll say know better sloppy arcs,0.027777777777777773
1095051944501170182,Mon Feb 11 20:08:23 +0000 2019,tfw u remember you go to animation school https://t.co/Nyq8iNGOdo,tfw u remember go animation school https //t.co/Nyq8iNGOdo,0.0
1094720965471293443,Sun Feb 10 22:13:11 +0000 2019,@6ftbutch @ironcircuscomix ohh congrats!!,6ftbutch ironcircuscomix ohh congrats,0.0
1094720523752431616,Sun Feb 10 22:11:26 +0000 2019,@6ftbutch ohh what was the pitch for?,6ftbutch ohh pitch,0.0
1094698093101105152,Sun Feb 10 20:42:18 +0000 2019,hi guys! can anyone whos familiar with animation in csp tell me if its possible to split up cels that i accidentall… https://t.co/m9aA8G7J6b,hi guys anyone whos familiar animation csp tell possible split cels accidentall… https //t.co/m9aA8G7J6b,0.1875
1094688404699267072,Sun Feb 10 20:03:48 +0000 2019,i thought my art was getting a lil stiff lately so heres a lil clown girl i doodled during a call https://t.co/PsPuoFZqm1,thought art getting lil stiff lately heres lil clown girl doodled call https //t.co/PsPuoFZqm1,-0.2571428571428571
1094187318615965696,Sat Feb 09 10:52:40 +0000 2019,@hattersarts the pearl/bismuth!!!! yes!!,hattersarts pearl/bismuth yes,0.0
1094168325150646273,Sat Feb 09 09:37:12 +0000 2019,please consider the implications behind your words before telling me body types have a direct correlation to how fe… https://t.co/BDOSfeGLe3,please consider implications behind words telling body types direct correlation fe… https //t.co/BDOSfeGLe3,-0.15000000000000002
1094167537607155712,Sat Feb 09 09:34:04 +0000 2019,@qorquiq its not,qorquiq,0.0
1094167340856553472,Sat Feb 09 09:33:17 +0000 2019,i know what the femme/butch scale is im talking abt body type not presentation!!,know femme/butch scale im talking abt body type presentation,0.0
1094165775882035200,Sat Feb 09 09:27:04 +0000 2019,i want... a lesbian categorization system for body types like how the gays do (eg: pearl (steven universe) is a [le… https://t.co/dGnUEufw8M,want ... lesbian categorization system body types like gays eg pearl steven universe le… https //t.co/dGnUEufw8M,0.0
1093962167316025344,Fri Feb 08 19:58:00 +0000 2019,also please retweet this it would really help!!,also please retweet would really help,0.2
1093960141362397186,Fri Feb 08 19:49:57 +0000 2019,"""mari how bad is your laptop?"" it wont run any games that arent visual novels or rpgmaker",`` mari bad laptop '' wont run games arent visual novels rpgmaker,-0.3499999999999999
1093959470366031872,Fri Feb 08 19:47:17 +0000 2019,disclaimer that this is a completely altruistic donation!  i will not be doing commissions or prizes for anyone don… https://t.co/5YmRQ6ufgp,disclaimer completely altruistic donation commissions prizes anyone don… https //t.co/5YmRQ6ufgp,0.1
1093959086352318465,Fri Feb 08 19:45:45 +0000 2019,"I can get by fine for now because I do all my animation and editing work at school, but as soon as I lose access to… https://t.co/LPdeXqIVDh",I get fine I animation editing work school soon I lose access to… https //t.co/LPdeXqIVDh,0.4166666666666667
1093958740271943682,Fri Feb 08 19:44:23 +0000 2019,I'm a cartoonist studying animation in Denmark. I did not realise this is the path life would take me on when i bou… https://t.co/6w1YAXi5mh,I 'm cartoonist studying animation Denmark I realise path life would take bou… https //t.co/6w1YAXi5mh,0.0
1093946792155250689,Fri Feb 08 18:56:54 +0000 2019,someone on tcaf organize a panel about turning every piece of media youve ever consumed as a child and teen into ga… https://t.co/mLGetAKS0S,someone tcaf organize panel turning every piece media youve ever consumed child teen ga… https //t.co/mLGetAKS0S,0.0
1093585768390541312,Thu Feb 07 19:02:19 +0000 2019,"fav genres of youtube: 
-one person talks about a piece of media for 30 mins+
-real people try to recreate disembod… https://t.co/fGMaz9IGZo",fav genres youtube -one person talks piece media 30 mins+ -real people try recreate disembod… https //t.co/fGMaz9IGZo,0.2
1093046156614139905,Wed Feb 06 07:18:06 +0000 2019,@fridayafternoon omg vic congrats!!!!,fridayafternoon omg vic congrats,0.0
1092135292507701248,Sun Feb 03 18:58:39 +0000 2019,follow me on instagram if youd like more personal stuff/fun life updates in the stories and also if youre sick of m… https://t.co/ByQRRZQAeV,follow instagram youd like personal stuff/fun life updates stories also youre sick m… https //t.co/ByQRRZQAeV,-0.35714285714285715
1091954245673381889,Sun Feb 03 06:59:14 +0000 2019,whoooa this comic looks really fun and sexy... who could have possibly made this.... they must be a genius.... https://t.co/vGQVjmC9Nl,whoooa comic looks really fun sexy ... could possibly made ... must genius ... https //t.co/vGQVjmC9Nl,0.2625
1091833477069225985,Sat Feb 02 22:59:20 +0000 2019,@eskbl i like robin cause i like a the magic,eskbl like robin cause like magic,0.5
1091762999726096384,Sat Feb 02 18:19:17 +0000 2019,a lil #MeetTheArtist since its been a while https://t.co/vQgqFk5haE,lil MeetTheArtist since https //t.co/vQgqFk5haE,0.0
1091424484819636228,Fri Feb 01 19:54:09 +0000 2019,"My webcomic, https://t.co/3gr0tCNa48 is a comic about a lot of things, but its really important to me that its abou… https://t.co/SSdQVKtDZn",My webcomic https //t.co/3gr0tCNa48 comic lot things really important abou… https //t.co/SSdQVKtDZn,0.325
1091406035804397569,Fri Feb 01 18:40:50 +0000 2019,hourly comics day more like... its friday and im a student let me rest,hourly comics day like ... friday im student let rest,0.0
1091392949160763393,Fri Feb 01 17:48:50 +0000 2019,its femslash february which means you should read my webcomic https://t.co/3gr0tCNa48 where its femslash every month,femslash february means read webcomic https //t.co/3gr0tCNa48 femslash every month,0.0
1091367800743124993,Fri Feb 01 16:08:54 +0000 2019,i made him https://t.co/GQbIUhQind,made https //t.co/GQbIUhQind,0.0
1091047557097287696,Thu Jan 31 18:56:22 +0000 2019,@stutterhug and ur comics are always A+++++ so like.... none of that extra stuff is even necessary!!,stutterhug ur comics always A+++++ like ... none extra stuff even necessary,0.0
1091037486472671232,Thu Jan 31 18:16:21 +0000 2019,"if your basic draftsmanship is good, itll most likely do all the work for you. and turns out the best way to get go… https://t.co/q9TlknSMvv",basic draftsmanship good itll likely work turns best way get go… https //t.co/q9TlknSMvv,0.425
1091037097316806657,Thu Jan 31 18:14:49 +0000 2019,how much time do you spend on rendering? shading? inks? do you Need all that detail? would spot colour do the job j… https://t.co/mcBsjhW0D8,much time spend rendering shading inks Need detail would spot colour job j… https //t.co/mcBsjhW0D8,0.2
1091036820874383376,Thu Jan 31 18:13:43 +0000 2019,Real Honest To God Comics Advice: if the main reason you havent started drawing your comic is because “i dont have… https://t.co/hri6UR8k95,Real Honest To God Comics Advice main reason havent started drawing comic “ dont have… https //t.co/hri6UR8k95,0.4388888888888889
1090704560463769602,Wed Jan 30 20:13:26 +0000 2019,@mimiadraws shes chillin,mimiadraws shes chillin,0.0
1090703845448171521,Wed Jan 30 20:10:35 +0000 2019,"peritale x @bigbudpress 
fake collab because i love to draw ocs in clothes i want https://t.co/xI0sDmslSq",peritale x bigbudpress fake collab love draw ocs clothes want https //t.co/xI0sDmslSq,0.0
1089790473177362432,Mon Jan 28 07:41:10 +0000 2019,@chootalks dumb thicc...,chootalks dumb thicc ...,-0.375
1089609765544775683,Sun Jan 27 19:43:06 +0000 2019,@AngrygirLcomics comics is prose for people who only know how to write the dialogue bits,AngrygirLcomics comics prose people know write dialogue bits,0.0
1089599246704226304,Sun Jan 27 19:01:18 +0000 2019,@hattersarts its so rare for me to watch a show and feel compelled to email them to beg to work there lol. also i t… https://t.co/o05JskDGja,hattersarts rare watch show feel compelled email beg work lol also t… https //t.co/o05JskDGja,0.55
1089596011230711809,Sun Jan 27 18:48:27 +0000 2019,@hattersarts its SO GOOD i want more ppl to watch it... art direction is sooo stunning,hattersarts SO GOOD want ppl watch ... art direction sooo stunning,0.6
1089586269989072896,Sun Jan 27 18:09:44 +0000 2019,i hate how drows look in the playbook so i fucked them up,hate drows look playbook fucked,-0.7
1089583789452476416,Sun Jan 27 17:59:53 +0000 2019,my drow bard mitya he sucks https://t.co/JntVsSayfQ,drow bard mitya sucks https //t.co/JntVsSayfQ,-0.3
1088891052159889408,Fri Jan 25 20:07:12 +0000 2019,"the best part about netflix series chilling adventures of sabrina is the implication that judas, of the bible fame, was a witch",best part netflix series chilling adventures sabrina implication judas bible fame witch,0.25
1088886419542679554,Fri Jan 25 19:48:47 +0000 2019,the easiest and cheapest way to support me on #artistpayday is to buy a copy of my embarrassing autobio about being… https://t.co/Lzko4884Gr,easiest cheapest way support artistpayday buy copy embarrassing autobio being… https //t.co/Lzko4884Gr,0.0
1088682787593486336,Fri Jan 25 06:19:37 +0000 2019,@mickequ holy SHIT,mickequ holy SHIT,-0.2
1088111223357476865,Wed Jan 23 16:28:26 +0000 2019,ive only been going to the gym for a couple months but i think people who sit at exercise machines on their phone s… https://t.co/7rBrqmhQqX,ive going gym couple months think people sit exercise machines phone s… https //t.co/7rBrqmhQqX,0.0
1087651529442689024,Tue Jan 22 10:01:46 +0000 2019,@torpordust i literally woke up to ppl posting screencaps lol like come on,torpordust literally woke ppl posting screencaps lol like come,0.8
1087068096446251008,Sun Jan 20 19:23:25 +0000 2019,@faith_schaffer its january,faith_schaffer january,0.0
1087035547703537666,Sun Jan 20 17:14:05 +0000 2019,im super obsessed w the new @lazyoaf collection https://t.co/ct6gRv7jnE,im super obsessed w new lazyoaf collection https //t.co/ct6gRv7jnE,-0.01010101010101011
1086991246084706305,Sun Jan 20 14:18:03 +0000 2019,@Shizamura omg sorry abt the late reply but yea totally i actually rly love ur work!! dm me with ur email so i can send info!,Shizamura omg sorry abt late reply yea totally actually rly love ur work dm ur email send info,-0.07500000000000001
1086990984607612929,Sun Jan 20 14:17:00 +0000 2019,@Cedric_Babouche WOW!! really nice to see it finished since seeing it at taw,Cedric_Babouche WOW really nice see finished since seeing taw,0.35
1086592882545438720,Sat Jan 19 11:55:05 +0000 2019,@6ftlesbian sfhhdjs the single arm coming out of the torso,6ftlesbian sfhhdjs single arm coming torso,-0.07142857142857142
1086436024488738816,Sat Jan 19 01:31:47 +0000 2019,sonic the hedgehog https://t.co/2Q2nrQTK4n,sonic hedgehog https //t.co/2Q2nrQTK4n,0.0
1086371000168734731,Fri Jan 18 21:13:24 +0000 2019,dm me if interested,dm interested,0.25
1086364755554721794,Fri Jan 18 20:48:36 +0000 2019,hewwooo i need 2 more ppl,hewwooo need 2 ppl,0.0
1086339119603769346,Fri Jan 18 19:06:43 +0000 2019,@6ftlesbian its because on insta stories you cant publicly reply and hes scared of ppl agreeing with u LOL,6ftlesbian insta stories cant publicly reply hes scared ppl agreeing u LOL,0.4
1086338518908059648,Fri Jan 18 19:04:20 +0000 2019,@6ftlesbian GOD LOL I JUST SEEN THE INSTA STORY.... HE TAGGED U IN IT..... WILD,6ftlesbian GOD LOL I JUST SEEN THE INSTA STORY ... HE TAGGED U IN IT ... .. WILD,0.45
1086338150182600704,Fri Jan 18 19:02:52 +0000 2019,@6ftlesbian WTF what a babyyyy,6ftlesbian WTF babyyyy,-0.5
1086224667931750400,Fri Jan 18 11:31:56 +0000 2019,@6ftlesbian THE SARDONYX??????? WHAT!!!!???,6ftlesbian THE SARDONYX WHAT,0.0
1086191975202779136,Fri Jan 18 09:22:02 +0000 2019,@irukasango omg thank u ruka!! ☺️,irukasango omg thank u ruka ☺️,0.0
1085996596335165440,Thu Jan 17 20:25:40 +0000 2019,@enenkay god i miss dungeon world.... im so proud of him,enenkay god miss dungeon world ... im proud,0.8
1085995437457358848,Thu Jan 17 20:21:03 +0000 2019,@enenkay i wanna know abt his adventures....,enenkay wan na know abt adventures ...,-0.2
1085991095820013571,Thu Jan 17 20:03:48 +0000 2019,Look at my small lesbians! Stay tuned for where u can get them! https://t.co/yKImdGwN25,Look small lesbians Stay tuned u get https //t.co/yKImdGwN25,-0.25
1085973264885796866,Thu Jan 17 18:52:57 +0000 2019,@stebvi WHOA,stebvi WHOA,0.0
1085765523193978881,Thu Jan 17 05:07:27 +0000 2019,@Velinxi ig its way too late now but when i was 17-18 and not so much Talented but rly prolific/had a much older gr… https://t.co/7soD70RC3Q,Velinxi ig way late 17-18 much Talented rly prolific/had much older gr… https //t.co/7soD70RC3Q,0.18888888888888888
1085758102648049664,Thu Jan 17 04:37:58 +0000 2019,@enenkay ohh i love his lil eyes....,enenkay ohh love lil eyes ...,0.5
1085306726407114752,Tue Jan 15 22:44:22 +0000 2019,what if the fairy godmother from cinderella was stupid https://t.co/CobMzqPxDl,fairy godmother cinderella stupid https //t.co/CobMzqPxDl,-0.7999999999999999
1085290450037194753,Tue Jan 15 21:39:41 +0000 2019,theyd be due in 2-ish months btw,theyd due 2-ish months btw,-0.125
1085284534843858949,Tue Jan 15 21:16:11 +0000 2019,@ieafysapien sooo cute!!!,ieafysapien sooo cute,0.5
1085282559624388610,Tue Jan 15 21:08:20 +0000 2019,its that time of the year again!chapter 5 is coming to an end so if any mutuals wanna do guest art for peritale ple… https://t.co/BsUuMhOyH1,time year chapter 5 coming end mutuals wan na guest art peritale ple… https //t.co/BsUuMhOyH1,-0.2
1085252093622079488,Tue Jan 15 19:07:16 +0000 2019,i dont know why i said wowie in this tweet. im really tired guys,dont know said wowie tweet im really tired guys,-0.4
