id,created_at,original_text,clean_text,polarity
1203743053397286912,Sun Dec 08 18:28:03 +0000 2019,"this was the ""nice"" edition because i sent these out as postcards to mutuals https://t.co/RfVYmxymvw",`` nice '' edition sent postcards mutuals https //t.co/RfVYmxymvw,0.6
1203742032977694720,Sun Dec 08 18:23:59 +0000 2019,@bees_enthusiast @chootalks its @prettypastelpls im obsessed with her channel it always cheers me up,bees_enthusiast chootalks prettypastelpls im obsessed channel always cheers,-0.5
1203741814315978752,Sun Dec 08 18:23:07 +0000 2019,i care about and deeply miss my lesbians,care deeply miss lesbians,0.0
1203741402821214208,Sun Dec 08 18:21:29 +0000 2019,god remember this peritale Greatest Hit from a couple years ago when I had time to do christmas illustrations becau… https://t.co/3ZVxRnRlfU,god remember peritale Greatest Hit couple years ago I time christmas illustrations becau… https //t.co/3ZVxRnRlfU,1.0
1203737380903100416,Sun Dec 08 18:05:30 +0000 2019,@chootalks theres a youtuber who does pastel/harajuku fashion haul videos and rewatching those is my depression mood,chootalks theres youtuber pastel/harajuku fashion haul videos rewatching depression mood,0.0
1203668400553283584,Sun Dec 08 13:31:24 +0000 2019,there has never been stronger proof that art and craft are different disciplines than me trying to gift wrap christmas presents,never stronger proof art craft different disciplines trying gift wrap christmas presents,0.0
1203369333050744834,Sat Dec 07 17:43:01 +0000 2019,nominating “when i was in the third grade i thought that i was gay cause i could draw” as most iconic song lyric of the 2010s,nominating “ third grade thought gay cause could draw ” iconic song lyric 2010s,0.2916666666666667
1203319221192663040,Sat Dec 07 14:23:53 +0000 2019,@MystifySerenity bro come on https://t.co/Uat1fgTpHL,MystifySerenity bro come https //t.co/Uat1fgTpHL,0.0
1203295703189086208,Sat Dec 07 12:50:26 +0000 2019,nailed it is the perfect show https://t.co/YQYUY6mgpd,nailed perfect show https //t.co/YQYUY6mgpd,1.0
1203028351096672258,Fri Dec 06 19:08:04 +0000 2019,if ur gonna wholesale steal an iconic unmistakeable character design to make ocs u could at least own up to it but what do i know,ur gon na wholesale steal iconic unmistakeable character design make ocs u could least know,0.1
1202856970191065088,Fri Dec 06 07:47:04 +0000 2019,spotify sending out wrapped results december 5th like it knows for the next 3 weeks the only thing passing through… https://t.co/Fv7ZeTsid9,spotify sending wrapped results december 5th like knows next 3 weeks thing passing through… https //t.co/Fv7ZeTsid9,0.0
1202586541975130112,Thu Dec 05 13:52:29 +0000 2019,this whiplash https://t.co/MPciFfNqMD,whiplash https //t.co/MPciFfNqMD,0.0
1202351591384322058,Wed Dec 04 22:18:52 +0000 2019,bodypump culture is the striking fight or flight response your body immediately has to pink’s walk me home,bodypump culture striking fight flight response body immediately pink ’ walk home,0.2
1201421647842086913,Mon Dec 02 08:43:36 +0000 2019,"Child: comedian
Preteen: cartoonist
Teen: literary editor
Now: cartoonist https://t.co/rx3JAvY9h3",Child comedian Preteen cartoonist Teen literary editor Now cartoonist https //t.co/rx3JAvY9h3,0.05
1201402265917100032,Mon Dec 02 07:26:35 +0000 2019,(this is a joke tweet),joke tweet,0.0
1201402216814395393,Mon Dec 02 07:26:24 +0000 2019,if you know and artsy kid and wanna give them something over the holidays dont give them an art set because art is… https://t.co/hYjptIBqyp,know artsy kid wan na give something holidays dont give art set art is… https //t.co/hYjptIBqyp,-0.2
1201116895266660352,Sun Dec 01 12:32:38 +0000 2019,lrt translates to “professional inquiries are made over email” anyway please stop sending me dms or discord message… https://t.co/PDXdKRZQ26,lrt translates “ professional inquiries made email ” anyway please stop sending dms discord message… https //t.co/PDXdKRZQ26,0.1
1200872117413302278,Sat Nov 30 20:19:58 +0000 2019,choose my pokemon type from the ones ppl said i was like a year ago,choose pokemon type ones ppl said like year ago,0.0
1199771950337478656,Wed Nov 27 19:28:18 +0000 2019,https://t.co/3gr0tCNa48 mom and dad are fighting #hiveworks https://t.co/uhQ6SNUa1V,https //t.co/3gr0tCNa48 mom dad fighting hiveworks https //t.co/uhQ6SNUa1V,0.0
1199608176594870273,Wed Nov 27 08:37:31 +0000 2019,@hawberries_ DO WOMEN DEADASS LOOK LIKE THIS EDIT TO YOU? REAL WOMEN?,hawberries_ DO WOMEN DEADASS LOOK LIKE THIS EDIT TO YOU REAL WOMEN,0.2
1199366704154972162,Tue Nov 26 16:38:00 +0000 2019,god if holly black was every like id love to do a comic adaptation of the cruel prince trilogy id kill for that job,god holly black every like id love comic adaptation cruel prince trilogy id kill job,-0.10416666666666666
1198264435443458048,Sat Nov 23 15:37:58 +0000 2019,(me poking my Kpop Friend) which ones are those? are they good? is it good kpop?,poking Kpop Friend ones good good kpop,0.7
1198263832499634176,Sat Nov 23 15:35:34 +0000 2019,"i still think about you* ever day

*(the girls at porto pride who had banners of their fav kpop ships)",still think you* ever day girls porto pride banners fav kpop ships,0.0
1197921899722002432,Fri Nov 22 16:56:51 +0000 2019,its Popping Off in life of melody https://t.co/3gr0tCNa48 #hiveworks https://t.co/GNrH2OBtVm,Popping Off life melody https //t.co/3gr0tCNa48 hiveworks https //t.co/GNrH2OBtVm,0.0
1197588168234717189,Thu Nov 21 18:50:44 +0000 2019,@Suspu god im in denmark so its not even That bad but in already feeling the depression,Suspu god im denmark even That bad already feeling depression,-0.6999999999999998
1197255569410789376,Wed Nov 20 20:49:06 +0000 2019,@RianSygh 💖 pinky....,RianSygh 💖 pinky ...,0.0
1196755577235476486,Tue Nov 19 11:42:18 +0000 2019,“behind the scenes people who worked on this talked about this character being lgbt!! the representation!!!” come o… https://t.co/VXiMppFyYR,“ behind scenes people worked talked character lgbt representation ” come o… https //t.co/VXiMppFyYR,-0.4
1196553014326235138,Mon Nov 18 22:17:24 +0000 2019,@yoshisquared hey! just wondering about the sizing for these because the hip size is a little concerning. im a uk12… https://t.co/DNaYPDX6rr,yoshisquared hey wondering sizing hip size little concerning im uk12… https //t.co/DNaYPDX6rr,-0.1875
1196547900425281537,Mon Nov 18 21:57:04 +0000 2019,"it was pocky day a week ago and this is my, as the kids call it, depression meal https://t.co/8dyOCugdYj",pocky day week ago kids call depression meal https //t.co/8dyOCugdYj,0.0
1196495050047442944,Mon Nov 18 18:27:04 +0000 2019,Things Are Happening in life of melody https://t.co/3gr0tCNa48 #hiveworks https://t.co/L289SffpmC,Things Are Happening life melody https //t.co/3gr0tCNa48 hiveworks https //t.co/L289SffpmC,0.0
1196491199516991489,Mon Nov 18 18:11:46 +0000 2019,tfw ur only physical manifestation is se wind and a pile of leaves and ur trying to set up ur lonely widower husban… https://t.co/V0dkWigzbt,tfw ur physical manifestation se wind pile leaves ur trying set ur lonely widower husban… https //t.co/V0dkWigzbt,-0.04999999999999999
1196188834574295041,Sun Nov 17 22:10:16 +0000 2019,"@dokirosi oh i definitely agree! like i said, i really Like that its bringing 2d back but the second tweet in this… https://t.co/Vd3oXybZ94",dokirosi oh definitely agree like said really Like bringing 2d back second tweet this… https //t.co/Vd3oXybZ94,0.05
1196182564261826560,Sun Nov 17 21:45:21 +0000 2019,@arythusa yeah! and if im gonna be honest as gorgeous as the lighting looked the design direction Did look pretty l… https://t.co/cd8YSvFjkB,arythusa yeah im gon na honest gorgeous lighting looked design direction Did look pretty l… https //t.co/cd8YSvFjkB,0.5166666666666666
1196017064370167808,Sun Nov 17 10:47:43 +0000 2019,i think it takes away from the charm of 2d animation and while i think its a very beautiful experiment i dont want… https://t.co/dDYT8cISTy,think takes away charm 2d animation think beautiful experiment dont want… https //t.co/dDYT8cISTy,0.85
1196016848791392256,Sun Nov 17 10:46:52 +0000 2019,this is maybe an Unpopular Onion but while i appreciate how stunning the final comping in klaus looks i dont think… https://t.co/NfkDRvB2Tb,maybe Unpopular Onion appreciate stunning final comping klaus looks dont think… https //t.co/NfkDRvB2Tb,0.25
1195987488696864769,Sun Nov 17 08:50:12 +0000 2019,@reimenayee i kept a plastic 7/11 bag in my backpack lol,reimenayee kept plastic 7/11 bag backpack lol,0.8
1195986511587618818,Sun Nov 17 08:46:19 +0000 2019,@reimenayee god never go to japan if the lack of garbage cans bother u there are Zero out on the street u have to h… https://t.co/XVRQhoD9JA,reimenayee god never go japan lack garbage cans bother u Zero street u h… https //t.co/XVRQhoD9JA,0.0
1195764079043993602,Sat Nov 16 18:02:27 +0000 2019,throwback to this very quick animation i did back when the game was announced! https://t.co/fIm1Tq6paj,throwback quick animation back game announced https //t.co/fIm1Tq6paj,-0.022222222222222237
1194665537122570241,Wed Nov 13 17:17:14 +0000 2019,i learned how to draw https://t.co/FcAQGRFvnV,learned draw https //t.co/FcAQGRFvnV,0.0
1194641144359145472,Wed Nov 13 15:40:18 +0000 2019,i actually started my Online Career as a fanfic writer. i didnt know how to draw and didnt like it That much. then… https://t.co/TmZsjhkZkl,actually started Online Career fanfic writer didnt know draw didnt like That much then… https //t.co/TmZsjhkZkl,0.1
1194640336951422978,Wed Nov 13 15:37:06 +0000 2019,i dont even think i was drawing in 2010 lmao i wanted to be a newspaper editor. where did i go wrong......,dont even think drawing 2010 lmao wanted newspaper editor go wrong ... ...,0.04999999999999999
1194623897079046144,Wed Nov 13 14:31:46 +0000 2019,@MagnoliaPearl scott pilgrim...... came out in 2010..............,MagnoliaPearl scott pilgrim ... ... came 2010 ... ... ... ... ..,0.0
1194623763674877953,Wed Nov 13 14:31:14 +0000 2019,what if i just became a beauty/fashion twitter. drawing is so hard and buying cute clothes is so easy,became beauty/fashion twitter drawing hard buying cute clothes easy,0.21388888888888888
1194623526810062849,Wed Nov 13 14:30:18 +0000 2019,@imfckngr8 im from brazil so i did not forget about this just like how i didnt forget that colourpop specifically h… https://t.co/fMAoCaMrzF,imfckngr8 im brazil forget like didnt forget colourpop specifically h… https //t.co/fMAoCaMrzF,0.0
1194321240107864064,Tue Nov 12 18:29:07 +0000 2019,"@Jolliejackdaw it cant be theyve been putting out new content since i think september and the sd palette was announced like, only last month",Jolliejackdaw cant theyve putting new content since think september sd palette announced like last month,0.06818181818181818
1194319439522652162,Tue Nov 12 18:21:58 +0000 2019,COCONUTS??????? NOW?????,COCONUTS NOW,0.0
1194319167345872900,Tue Nov 12 18:20:53 +0000 2019,"i have not cultivated the audience to understand this tweet but:
conspiracy: something happened with colourpops for… https://t.co/3HtDDE3Das",cultivated audience understand tweet conspiracy something happened colourpops for… https //t.co/3HtDDE3Das,0.0
1194316020560867328,Tue Nov 12 18:08:23 +0000 2019,i havent had wifi for a while but im finding a way. also i do what i want etc https://t.co/96qp3noDN5,havent wifi im finding way also want etc https //t.co/96qp3noDN5,0.0
1193515147161210881,Sun Nov 10 13:06:00 +0000 2019,i wanna be... where the thoughtbubble are......,wan na ... thoughtbubble ... ...,-0.2
1193486559686922240,Sun Nov 10 11:12:24 +0000 2019,@torpordust ughh i wish i was there id come runnin,torpordust ughh wish id come runnin,0.0
1193177604435697664,Sat Nov 09 14:44:43 +0000 2019,@mvambrosoni the style itself doesnt bother me too much if theres a reason for it so im glad there is but for now i… https://t.co/QKOvDvyTyZ,mvambrosoni style doesnt bother much theres reason im glad i… https //t.co/QKOvDvyTyZ,0.35
1193152209569140738,Sat Nov 09 13:03:49 +0000 2019,like not to be That Guy but it really takes you out of it,like That Guy really takes,0.2
1193151106391724032,Sat Nov 09 12:59:26 +0000 2019,"(war veteran who never went to high school voice) my old colleague in the war needed time to recuperate, i didnt overmuch think about it",war veteran never went high school voice old colleague war needed time recuperate didnt overmuch think,0.08666666666666667
1193150637225250816,Sat Nov 09 12:57:34 +0000 2019,does the magnus archives get..... better writing? or does every testimony regardless of background sound like an er… https://t.co/HSXZ6m4noq,magnus archives get ... .. better writing every testimony regardless background sound like er… https //t.co/HSXZ6m4noq,0.45
1192847900860178432,Fri Nov 08 16:54:36 +0000 2019,@alexisparade THANK U im obsessed w it,alexisparade THANK U im obsessed w,-0.5
1192532099946962945,Thu Nov 07 19:59:43 +0000 2019,@enenkay i was like Bracing for the twist as soon as i saw the character design.... he wasnt Cutesy Dixar enough so… https://t.co/oMOtwpsChT,enenkay like Bracing twist soon saw character design ... wasnt Cutesy Dixar enough so… https //t.co/oMOtwpsChT,0.0
1192518265454694400,Thu Nov 07 19:04:45 +0000 2019,@alexisparade bruh where did u get that necklace,alexisparade bruh u get necklace,0.0
1192486244997095425,Thu Nov 07 16:57:30 +0000 2019,i dont actually have much faith that the protag in s/oul is gonna remain looking like a black dude for more than ma… https://t.co/WDFo8Q5IO7,dont actually much faith protag s/oul gon na remain looking like black dude ma… https //t.co/WDFo8Q5IO7,0.016666666666666677
1192482784750772224,Thu Nov 07 16:43:45 +0000 2019,“but hes like a ghost!!!” he could b... a black ghost.....,“ hes like ghost ” could b ... black ghost ... ..,-0.16666666666666666
1192482347511435264,Thu Nov 07 16:42:01 +0000 2019,dixar weve talked about this you can have poc chars in movies without turning them into things 10 minutes in,dixar weve talked poc chars movies without turning things 10 minutes,0.0
1192076536914071552,Wed Nov 06 13:49:28 +0000 2019,@myrdrottningen omg lol its tsukishima but kuroo is also a pretty good one,myrdrottningen omg lol tsukishima kuroo also pretty good one,0.5833333333333334
1192067563141943302,Wed Nov 06 13:13:49 +0000 2019,@myrdrottningen i do have a fave and ppl have associated me w him so im curious if ud get it right lol,myrdrottningen fave ppl associated w im curious ud get right lol,0.32857142857142857
1191761600224604161,Tue Nov 05 16:58:02 +0000 2019,wish my wifi would work so i could watch shera (its been 2 days im spiraling),wish wifi would work could watch shera 2 days im spiraling,0.0
1191752847496548352,Tue Nov 05 16:23:15 +0000 2019,if you like or rt a reply to a locked twitter you dont follow sorry to say this but youre a freak,like rt reply locked twitter dont follow sorry say youre freak,-0.5
1191027982623752194,Sun Nov 03 16:22:53 +0000 2019,who would win: a dedicated skincare regimen OR a bad quirk ive had since childhood,would win dedicated skincare regimen OR bad quirk ive since childhood,0.0500000000000001
1191027565529649153,Sun Nov 03 16:21:14 +0000 2019,"me: i wonder why my skin is all really clear except for my chin area
(cartoon flashbacks to my ideal working positi… https://t.co/IchP6Q8aLq",wonder skin really clear except chin area cartoon flashbacks ideal working positi… https //t.co/IchP6Q8aLq,0.5
1191023496601706496,Sun Nov 03 16:05:04 +0000 2019,@dokirosi man im all for subtle fan merch cause i like stuff thats rly wearable everyday (i rly like the su replica… https://t.co/ner9Hmtm30,dokirosi man im subtle fan merch cause like stuff thats rly wearable everyday rly like su replica… https //t.co/ner9Hmtm30,-0.26666666666666666
1190681875213422592,Sat Nov 02 17:27:35 +0000 2019,@alexisparade has there ever been a con experience on earth where there wasnt at least one rando with a complete la… https://t.co/qDvgdZIQ97,alexisparade ever con experience earth wasnt least one rando complete la… https //t.co/qDvgdZIQ97,-0.09999999999999999
1190680048593969153,Sat Nov 02 17:20:20 +0000 2019,how do people get comic ARCs.. is it like a pr list? i want books to read...,people get comic ARCs.. like pr list want books read ...,0.25
1190672913885802496,Sat Nov 02 16:51:58 +0000 2019,@HappyCatDragon no they dont need to know my email password to sign me up for mailing lists i dont think its a viru… https://t.co/MBCL1aIQV2,HappyCatDragon dont need know email password sign mailing lists dont think viru… https //t.co/MBCL1aIQV2,0.0
1190665324745691137,Sat Nov 02 16:21:49 +0000 2019,"its my professional email too, which i need to have fairly clean so i can, get emails",professional email need fairly clean get emails,0.23333333333333334
1190665102225235969,Sat Nov 02 16:20:56 +0000 2019,hey so someones been using my email address to subscribe to a myriad of different bullshit websites. how... do i stop this?,hey someones using email address subscribe myriad different bullshit websites ... stop,0.0
1190291069973516288,Fri Nov 01 15:34:40 +0000 2019,"@robochai in a world, where all horses are dead",robochai world horses dead,-0.2
1190290265669537792,Fri Nov 01 15:31:28 +0000 2019,@robochai this is why you make a fantasy comic,robochai make fantasy comic,0.25
1190030218209181696,Thu Oct 31 22:18:08 +0000 2019,@bvcketdraws @WebcomicUpdates CUUUUTE!!!! CONGRATS DUDE!,bvcketdraws WebcomicUpdates CUUUUTE CONGRATS DUDE,0.0
1190004279551115269,Thu Oct 31 20:35:04 +0000 2019,didnt have enough brain juice to come up w a good costume for aymeric lol,didnt enough brain juice come w good costume aymeric lol,0.5
1190003186188398592,Thu Oct 31 20:30:43 +0000 2019,i completely forgot how to draw these characters https://t.co/kA7DDIBqfO,completely forgot draw characters https //t.co/kA7DDIBqfO,0.1
1189982633104674819,Thu Oct 31 19:09:03 +0000 2019,halloween! https://t.co/6Lsj8u8IuV,halloween https //t.co/6Lsj8u8IuV,0.0
1189981677214412802,Thu Oct 31 19:05:15 +0000 2019,the telltale teeth marks on the cap of my top coat polish as i forget to open it before i paint my nails and dont w… https://t.co/FBSC6yC5C1,telltale teeth marks cap top coat polish forget open paint nails dont w… https //t.co/FBSC6yC5C1,0.25
1189971194642128896,Thu Oct 31 18:23:36 +0000 2019,yall goths have had your fun but as the ultimate prep tomorrow i reveal my true christmari form,yall goths fun ultimate prep tomorrow reveal true christmari form,0.21666666666666665
1189970976706060288,Thu Oct 31 18:22:44 +0000 2019,@boodlebrain i feel like u could rly pull off dressing as belle tbh!!!,boodlebrain feel like u could rly pull dressing belle tbh,0.0
1189947442835443712,Thu Oct 31 16:49:13 +0000 2019,congrats to everyone whos free from their inktober curse today,congrats everyone whos free inktober curse today,0.4
1189607032481030145,Wed Oct 30 18:16:33 +0000 2019,delighted by this maleficent review that Also refers to the villain exclusively by “michelle pfeiffer queen”,delighted maleficent review Also refers villain exclusively “ michelle pfeiffer queen ”,0.7
1189286309585739778,Tue Oct 29 21:02:06 +0000 2019,juuuust in case u missed this,juuuust case u missed,0.0
1189269028109508610,Tue Oct 29 19:53:26 +0000 2019,sometimes you just sit down and learn to draw taurs (taur is @_sloanzone's) https://t.co/trIAXjMCD5,sometimes sit learn draw taurs taur _sloanzone 's https //t.co/trIAXjMCD5,0.0
1188898645296472065,Mon Oct 28 19:21:40 +0000 2019,"havent boosted my webcomic in a while, but Life of Melody is still going on the https://t.co/3gr0tCNa48 website!… https://t.co/pcML041BuT",havent boosted webcomic Life Melody still going https //t.co/3gr0tCNa48 website … https //t.co/pcML041BuT,0.0
1188892542512914434,Mon Oct 28 18:57:25 +0000 2019,@MollyOstertag happy birthday!!!,MollyOstertag happy birthday,0.8
1188567364952117255,Sun Oct 27 21:25:16 +0000 2019,incredibly funny preview image for brokeback mountain https://t.co/2dkS5Buv8c,incredibly funny preview image brokeback mountain https //t.co/2dkS5Buv8c,0.25
1188562712898527232,Sun Oct 27 21:06:47 +0000 2019,@myrdrottningen you cant fool me myra i know u made a moomin,myrdrottningen cant fool myra know u made moomin,0.0
1188445284227006466,Sun Oct 27 13:20:10 +0000 2019,hey everyone look https://t.co/owg5AeSCT8,hey everyone look https //t.co/owg5AeSCT8,0.0
1188108627535630336,Sat Oct 26 15:02:25 +0000 2019,@jackieleighart i know what lost mines of phandelver is and i know all my friends also know what lost mines of phan… https://t.co/UMstPc2Zbm,jackieleighart know lost mines phandelver know friends also know lost mines phan… https //t.co/UMstPc2Zbm,0.0
1188104372934324226,Sat Oct 26 14:45:31 +0000 2019,yall im not doing The Taz Campaign lmfao,yall im The Taz Campaign lmfao,0.0
1187999454420451328,Sat Oct 26 07:48:36 +0000 2019,what are some good premade dnd campaigns for a rookie dm?,good premade dnd campaigns rookie dm,0.7
1187395453840711681,Thu Oct 24 15:48:31 +0000 2019,there was never just like a rando guy in my female friend groups and ive never been a rando girl within male friend groups,never like rando guy female friend groups ive never rando girl within male friend groups,0.0
1187395324433842182,Thu Oct 24 15:48:00 +0000 2019,im curious as to where the token girl/token guy in a group trope originated bc ever since i can remember my groups… https://t.co/NXWzk49p6U,im curious token girl/token guy group trope originated bc ever since remember groups… https //t.co/NXWzk49p6U,-0.1
1187362938451042304,Thu Oct 24 13:39:19 +0000 2019,@PlinaGanucheau @VViiNNG is this in house or could it be remote?,PlinaGanucheau VViiNNG house could remote,-0.1
1187360015209893890,Thu Oct 24 13:27:42 +0000 2019,every drawing of belle makes my heart so warm,every drawing belle makes heart warm,0.6
1187106457235406850,Wed Oct 23 20:40:09 +0000 2019,apparently i drew this last year. i have no recollection of this but thanks past mari https://t.co/kFzpUjMwnF,apparently drew last year recollection thanks past mari https //t.co/kFzpUjMwnF,0.0
1187032993124306946,Wed Oct 23 15:48:14 +0000 2019,@alexisparade omg where is this,alexisparade omg,0.0
1186956634339364865,Wed Oct 23 10:44:48 +0000 2019,hey skincare side of twitter in what order should u use skincare products (am And pm) im trying to set up a routine… https://t.co/ayEr83E244,hey skincare side twitter order u use skincare products And pm im trying set routine… https //t.co/ayEr83E244,0.0
1186708510622572544,Tue Oct 22 18:18:51 +0000 2019,"@choowenjee (ferdinand, handing out buttons) i am ferdinand von aegir!!",choowenjee ferdinand handing buttons ferdinand von aegir,0.0
1186707078125178882,Tue Oct 22 18:13:10 +0000 2019,@choowenjee edelgard student council president,choowenjee edelgard student council president,0.0
1186686069292568577,Tue Oct 22 16:49:41 +0000 2019,I hit 50k on instagram!! and decided to do a #drawthisinyourstyle to celebrate! https://t.co/bub31hRy1s,I hit 50k instagram decided drawthisinyourstyle celebrate https //t.co/bub31hRy1s,0.0
1186378746619674631,Mon Oct 21 20:28:29 +0000 2019,"ADDENDUM: turns out the ""bloating"" look CAN be fat and occurs primarily in older folks! Thanks for letting me know!",ADDENDUM turns `` bloating '' look CAN fat occurs primarily older folks Thanks letting know,0.18333333333333335
1186362446119931905,Mon Oct 21 19:23:43 +0000 2019,some thots https://t.co/oynKeBUEdV,thots https //t.co/oynKeBUEdV,0.0
1186007497695465473,Sun Oct 20 19:53:17 +0000 2019,sorry i made leo a shimbo its in my nature,sorry made leo shimbo nature,-0.5
1186006456354725888,Sun Oct 20 19:49:08 +0000 2019,tiny fanart of one of my fave comics ive read this year! pls read roadqueen by @miraongchua https://t.co/CbEJEq2xsn,tiny fanart one fave comics ive read year pls read roadqueen miraongchua https //t.co/CbEJEq2xsn,0.0
1185311107331842050,Fri Oct 18 21:46:04 +0000 2019,"@hoodleehoo (youre a mean one mr grinch) youre a himbo, mr thymos",hoodleehoo youre mean one mr grinch youre himbo mr thymos,-0.3125
1184804244756598784,Thu Oct 17 12:11:59 +0000 2019,id like to formally apologise for not doing my skincare this morning. i was sleepy and didnt wanna do it,id like formally apologise skincare morning sleepy didnt wan na,-0.2
1184720030388412421,Thu Oct 17 06:37:20 +0000 2019,@nameoftheyear i know That im more baffled that there isnt a single comment pointing out how bad that dm is,nameoftheyear know That im baffled isnt single comment pointing bad dm,-0.3857142857142856
1184716495059853312,Thu Oct 17 06:23:18 +0000 2019,hey real quick why is this aita D&amp;D thread Crawling with weird racists https://t.co/EMMVUlGq4W,hey real quick aita D amp D thread Crawling weird racists https //t.co/EMMVUlGq4W,0.0
1184705615685398528,Thu Oct 17 05:40:04 +0000 2019,@aatmajapandya it LOOKS like a fancy little parfait boy shirt its excellent! hope u had a great day!!,aatmajapandya LOOKS like fancy little parfait boy shirt excellent hope u great day,0.5375
1184591928010170372,Wed Oct 16 22:08:18 +0000 2019,@CDawgVA i said GOOD youtube channel!!,CDawgVA said GOOD youtube channel,0.7
1184564266982105088,Wed Oct 16 20:18:24 +0000 2019,@tokimekiwaku (robot voice) horny people have no rights,tokimekiwaku robot voice horny people rights,0.0
1184563178371473408,Wed Oct 16 20:14:04 +0000 2019,found a pretty good youtube channel https://t.co/veZFdZperZ,found pretty good youtube channel https //t.co/veZFdZperZ,0.475
1184553649395122178,Wed Oct 16 19:36:12 +0000 2019,no one can fuck the strange vampire!!!,one fuck strange vampire,-0.225
