id,created_at,original_text,clean_text,polarity
1035283851982065664,Thu Aug 30 21:51:19 +0000 2018,hi mutuals i neeeeed oc cameos for a crowd piece,hi mutuals neeeeed oc cameos crowd piece,0.0
1035252813134213121,Thu Aug 30 19:47:59 +0000 2018,not really sure how i became an artist professionally when one of my strongest childhood memories is crying in clas… https://t.co/ggYJXVRxRb,really sure became artist professionally one strongest childhood memories crying clas… https //t.co/ggYJXVRxRb,0.13333333333333333
1035218171291152384,Thu Aug 30 17:30:20 +0000 2018,@geezmarty 😭 im glad!!,geezmarty 😭 im glad,0.5
1035204881529942017,Thu Aug 30 16:37:31 +0000 2018,"https://t.co/pLbtpccdlo updated! in which, theyre ready to go! #hiveworks

(RT, please!) https://t.co/04MXL9Zotc",https //t.co/pLbtpccdlo updated theyre ready go hiveworks RT please https //t.co/04MXL9Zotc,0.2
1034897678432444416,Wed Aug 29 20:16:48 +0000 2018,five days til the kickstarter aaaaaaa,five days til kickstarter aaaaaaa,0.0
1034715801163624449,Wed Aug 29 08:14:05 +0000 2018,@worm_woman its ilnp holographic nail polish,worm_woman ilnp holographic nail polish,0.0
1034709315574222848,Wed Aug 29 07:48:19 +0000 2018,for ppl who asked https://t.co/00Pr5QxaCt,ppl asked https //t.co/00Pr5QxaCt,0.0
1034695355051520000,Wed Aug 29 06:52:51 +0000 2018,artist quirks! https://t.co/3wmZbSHMFV,artist quirks https //t.co/3wmZbSHMFV,0.0
1034545827581054976,Tue Aug 28 20:58:40 +0000 2018,hey quick question why do funko pops Look Like That when their mascot looks like This https://t.co/I7APDJFz2c,hey quick question funko pops Look Like That mascot looks like This https //t.co/I7APDJFz2c,0.3333333333333333
1034542502617866240,Tue Aug 28 20:45:28 +0000 2018,6 days til launch!! https://t.co/KjOlragRAd,6 days til launch https //t.co/KjOlragRAd,0.0
1034534996416098304,Tue Aug 28 20:15:38 +0000 2018,@beesmygod @maddigzlz oh no... id never actually seen one of these before...,beesmygod maddigzlz oh ... id never actually seen one ...,0.0
1034218501378953216,Mon Aug 27 23:18:00 +0000 2018,@SlimeSloan yes i wanna see cherry blossom season!,SlimeSloan yes wan na see cherry blossom season,-0.2
1034217420548759553,Mon Aug 27 23:13:42 +0000 2018,"@SlimeSloan i love you too! and itll be a mystery forever... or like, it was a free coffee lol",SlimeSloan love itll mystery forever ... like free coffee lol,0.5666666666666668
1034215070429925376,Mon Aug 27 23:04:22 +0000 2018,"what they Did Not tell me is i had to put the sticker on my human body, and that would trigger every staff member o… https://t.co/bx3c8zkKsY",Did Not tell put sticker human body would trigger every staff member o… https //t.co/bx3c8zkKsY,0.0
1034214311152046080,Mon Aug 27 23:01:21 +0000 2018,"the Most mari thing that happened on our trip to japan, that i only remember in the dead of night, is that if you w… https://t.co/kX9be73tAo",Most mari thing happened trip japan remember dead night w… https //t.co/kX9be73tAo,0.15
1034122212033355777,Mon Aug 27 16:55:23 +0000 2018,@mangalheiro I STAN,mangalheiro I STAN,0.0
1034118215461490689,Mon Aug 27 16:39:30 +0000 2018,@faith_schaffer the one that freaks me out the most is when it tries to guess how im gonna reply lol,faith_schaffer one freaks tries guess im gon na reply lol,0.35000000000000003
1033801376516763650,Sun Aug 26 19:40:29 +0000 2018,@sofa_sofiaa BIG FAVE,sofa_sofiaa BIG FAVE,0.0
1033784965148934145,Sun Aug 26 18:35:17 +0000 2018,friend and classmate @Funeral_Biscuit pulled me back into the world of anthologies. im really proud of what we came… https://t.co/DAuf61XTE3,friend classmate Funeral_Biscuit pulled back world anthologies im really proud came… https //t.co/DAuf61XTE3,0.4
1033388746299920384,Sat Aug 25 16:20:51 +0000 2018,@MagnoliaPearl all i want from disenchantment is for elfo to stay [redacted] tbh.. my enjoyment of the show improved dramatically after that,MagnoliaPearl want disenchantment elfo stay redacted tbh.. enjoyment show improved dramatically,0.0
1033266789466157056,Sat Aug 25 08:16:14 +0000 2018,mutuals.... i need... oc cameos....,mutuals ... need ... oc cameos ...,0.0
1033079786216849408,Fri Aug 24 19:53:09 +0000 2018,The Life of Melody kickstarter launches in 10 DAYS! Consider backing to read about dads kissing https://t.co/DDmMwS2wQe,The Life Melody kickstarter launches 10 DAYS Consider backing read dads kissing https //t.co/DDmMwS2wQe,0.0
1033074008282030080,Fri Aug 24 19:30:11 +0000 2018,@paranaturalzack WHOA zack this is gorgeous... i was like holding my breath for the last few pages this is such a good comic 😭😭😭,paranaturalzack WHOA zack gorgeous ... like holding breath last pages good comic 😭😭😭,0.4125
1032720667722956800,Thu Aug 23 20:06:08 +0000 2018,this is the hardest ive ever been owned online https://t.co/Q4pOQWxcOT,hardest ive ever owned online https //t.co/Q4pOQWxcOT,0.0
1032707102458957829,Thu Aug 23 19:12:14 +0000 2018,@maddigzlz DRAGON BALL???? THE ANIME FOR CHILDREN????,maddigzlz DRAGON BALL THE ANIME FOR CHILDREN,0.0
1032279760032935938,Wed Aug 22 14:54:08 +0000 2018,unbelievable that guardian spice hasnt hired me after putting out this periwinkle recolour (this is a joke tweet i… https://t.co/lJhxLlQXN6,unbelievable guardian spice hasnt hired putting periwinkle recolour joke tweet i… https //t.co/lJhxLlQXN6,-0.25
1032218626206642176,Wed Aug 22 10:51:12 +0000 2018,@alizabees also this typography RULES,alizabees also typography RULES,0.0
1031993868244463617,Tue Aug 21 19:58:06 +0000 2018,@stripeyworm ohhh congrats kristina!!!!! time really flies!!!!!!!,stripeyworm ohhh congrats kristina time really flies,0.2
1031959567394119681,Tue Aug 21 17:41:48 +0000 2018,"im really nervous and excited about september, when i’ll be doing my first book kickstarter for life of melody. ple… https://t.co/Qutz9YgBoJ",im really nervous excited september ’ first book kickstarter life melody ple… https //t.co/Qutz9YgBoJ,0.27499999999999997
1031790003016351744,Tue Aug 21 06:28:01 +0000 2018,@maddigzlz omg maddi what the hell that sucks!!,maddigzlz omg maddi hell sucks,-0.3
1031668543144779782,Mon Aug 20 22:25:22 +0000 2018,"@__Styx__ sorry, accidentally missed a word, *mixed portuguese brazilian people",__Styx__ sorry accidentally missed word *mixed portuguese brazilian people,-0.25
1031668260423516161,Mon Aug 20 22:24:15 +0000 2018,@__Styx__ luso is the prefix for mixed portuguese ppl (like how franco-brazilian is french brazilian),__Styx__ luso prefix mixed portuguese ppl like franco-brazilian french brazilian,0.0
1031651685880528896,Mon Aug 20 21:18:23 +0000 2018,this again,,0.0
1031608832898871296,Mon Aug 20 18:28:06 +0000 2018,i feel validated whenever someone with a lesbian icon follows me or likes my tweets... thank u i do this for you,feel validated whenever someone lesbian icon follows likes tweets ... thank u,0.0
1031568873911459840,Mon Aug 20 15:49:19 +0000 2018,"Hi, #VisibleWomen, I'm Mari and I'm a luso-brazilian lesbian just out here drawing comics about mostly other lesbia… https://t.co/H5gn7B700X",Hi VisibleWomen I 'm Mari I 'm luso-brazilian lesbian drawing comics mostly lesbia… https //t.co/H5gn7B700X,0.5
1031522001016512512,Mon Aug 20 12:43:04 +0000 2018,@hedgemice @spatterdocks @thedinojay @ravenwarner @killswitchkatie im not in this! i wasnt at flamecon youre thinki… https://t.co/gWp5l8KZGf,hedgemice spatterdocks thedinojay ravenwarner killswitchkatie im wasnt flamecon youre thinki… https //t.co/gWp5l8KZGf,0.0
1031434846764195840,Mon Aug 20 06:56:45 +0000 2018,@cerigg @tiffbaxterillus @breebird33 @artemyiss @crowlees @milliemuns @alexabosy @nephelolivia OMGGGGGGGG THERE SHE… https://t.co/4DhgPtiJ60,cerigg tiffbaxterillus breebird33 artemyiss crowlees milliemuns alexabosy nephelolivia OMGGGGGGGG THERE SHE… https //t.co/4DhgPtiJ60,0.0
1031428028071641089,Mon Aug 20 06:29:39 +0000 2018,heres process pics just cause i have them (thumbs&gt;sketch&gt;inks&gt;flats) https://t.co/XKPSoQy3rB,heres process pics cause thumbs gt sketch gt inks gt flats https //t.co/XKPSoQy3rB,0.0
1031288641434337281,Sun Aug 19 21:15:47 +0000 2018,im gonna launch a new patreon comic september 1st! please look forward to it! https://t.co/0Bv4AuCqiZ,im gon na launch new patreon comic september 1st please look forward https //t.co/0Bv4AuCqiZ,0.19318181818181818
1031277708670582784,Sun Aug 19 20:32:20 +0000 2018,@narwhalnel honestly i dont think bojack horseman is an exception lol. the chars dont really grow or change that mu… https://t.co/g2THvG8jP9,narwhalnel honestly dont think bojack horseman exception lol chars dont really grow change mu… https //t.co/g2THvG8jP9,0.5333333333333333
1031226654339870721,Sun Aug 19 17:09:28 +0000 2018,Who is the hardest character to draw? — in peritale? its actually vallery lol! getting her bangs and her glasses to… https://t.co/j6hnxNKeIL,Who hardest character draw — peritale actually vallery lol getting bangs glasses to… https //t.co/j6hnxNKeIL,0.4
1031211416894750720,Sun Aug 19 16:08:55 +0000 2018,blease,blease,0.0
1031179514766913537,Sun Aug 19 14:02:09 +0000 2018,"wait god i fucked this up. i actually dont care for paprika, what i meant was perfect blue",wait god fucked actually dont care paprika meant perfect blue,0.1
1031178290491518981,Sun Aug 19 13:57:17 +0000 2018,"@stripeyworm :O!! uhhh gosh, maybee, hydrangea or agatha?",stripeyworm O uhhh gosh maybee hydrangea agatha,0.0
1031170087737286657,Sun Aug 19 13:24:41 +0000 2018,"what's your favorite 2d and 3d animated movies — off the top of my head howl’s moving castle, paprika, cat returns… https://t.co/VWpDCnVvJS",'s favorite 2d 3d animated movies — top head howl ’ moving castle paprika cat returns… https //t.co/VWpDCnVvJS,0.5
1031169171206352896,Sun Aug 19 13:21:03 +0000 2018,@starpyrate really love the single picture of all might surrounded by titty woman (and jotaro),starpyrate really love single picture might surrounded titty woman jotaro,0.2142857142857143
1031168082784526337,Sun Aug 19 13:16:43 +0000 2018,I love your work so much and you're a huge inspiration to me! Thank you for creating amazing content and characters… https://t.co/sG4Pk9J33o,I love work much 're huge inspiration Thank creating amazing content characters… https //t.co/sG4Pk9J33o,0.5000000000000001
1031165416897429505,Sun Aug 19 13:06:08 +0000 2018,girls.................. — yes https://t.co/0ZuwBen8GQ,girls ... ... ... ... ... ... — yes https //t.co/0ZuwBen8GQ,0.0
1031159517835419648,Sun Aug 19 12:42:41 +0000 2018,https://t.co/XthHYSYh5a come and ask me things its sunday im bored,https //t.co/XthHYSYh5a come ask things sunday im bored,-0.5
1031100374067933184,Sun Aug 19 08:47:40 +0000 2018,@beverlylove its weird how any villain will tend to represent toxic behaviours and ideologies its almost like we do… https://t.co/x28ObSGM2Y,beverlylove weird villain tend represent toxic behaviours ideologies almost like do… https //t.co/x28ObSGM2Y,-0.5
1030942711468179456,Sat Aug 18 22:21:11 +0000 2018,@mayakern unfortunately i have an education to start... another year...,mayakern unfortunately education start ... another year ...,-0.5
1030942119328997377,Sat Aug 18 22:18:49 +0000 2018,take me down to flame con city,take flame con city,0.0
1030903105272139778,Sat Aug 18 19:43:48 +0000 2018,Adult Cartoons have this weird facade of irony and negativity that doesnt hold a candle to stuff like community or… https://t.co/J3sOm1Mu7S,Adult Cartoons weird facade irony negativity doesnt hold candle stuff like community or… https //t.co/J3sOm1Mu7S,-0.2
1030902832843706368,Sat Aug 18 19:42:43 +0000 2018,"man idk if this holds any weight to it but i think... the reason so many adult comedy shows are really unfunny, at… https://t.co/GfN2Oaqhjq",man idk holds weight think ... reason many adult comedy shows really unfunny at… https //t.co/GfN2Oaqhjq,0.26666666666666666
1030769732948045825,Sat Aug 18 10:53:49 +0000 2018,@PrietoMx nodding,PrietoMx nodding,0.0
1030608261358276613,Sat Aug 18 00:12:11 +0000 2018,@starpyrate not if they kill each other first,starpyrate kill first,0.25
1030533525324349441,Fri Aug 17 19:15:13 +0000 2018,chance encounter https://t.co/iVxOdxjBiH,chance encounter https //t.co/iVxOdxjBiH,0.0
1030518166701658113,Fri Aug 17 18:14:11 +0000 2018,@nearlynoon yeah it is! its the 5 dollar tier anyone can read it whenever,nearlynoon yeah 5 dollar tier anyone read whenever,0.0
1030511235173896198,Fri Aug 17 17:46:39 +0000 2018,@marimaki yeah ill be posting the links everywhere i can lol,marimaki yeah ill posting links everywhere lol,0.15000000000000002
1030500655138566144,Fri Aug 17 17:04:36 +0000 2018,"hello, i could not physically be more nervous about announcing something, but Life of Melody, my patreon-only gay f… https://t.co/0xThAPfT06",hello could physically nervous announcing something Life Melody patreon-only gay f… https //t.co/0xThAPfT06,0.20833333333333334
1030208588810256385,Thu Aug 16 21:44:02 +0000 2018,@mayakern @KomunHorangi @CoeyKuhn @emcheeseman @Eric_Menge @RollaineDraws @cynicalpie @funambulilst OMG i missed th… https://t.co/cdIw7Ygn12,mayakern KomunHorangi CoeyKuhn emcheeseman Eric_Menge RollaineDraws cynicalpie funambulilst OMG missed th… https //t.co/cdIw7Ygn12,0.0
1030194472611655680,Thu Aug 16 20:47:57 +0000 2018,@stutterhug wow i cant believe the enchantress is WOLF RACIST,stutterhug wow cant believe enchantress WOLF RACIST,0.1
1030193077267431424,Thu Aug 16 20:42:24 +0000 2018,im an animal man my dick is huge lives are at stake,im animal man dick huge lives stake,0.4000000000000001
1030192627109560320,Thu Aug 16 20:40:37 +0000 2018,"(the beast, wandering into the streets of the village) yo come fuck this.... please come fuck this im so rich",beast wandering streets village yo come fuck ... please come fuck im rich,-0.1416666666666667
1030192436251971585,Thu Aug 16 20:39:51 +0000 2018,the stakes introduced in live action batb imply that if the beast doesnt find true love his entire staff will be ki… https://t.co/rDNJp1lwFG,stakes introduced live action batb imply beast doesnt find true love entire staff ki… https //t.co/rDNJp1lwFG,0.21727272727272728
1030170831421358081,Thu Aug 16 19:14:00 +0000 2018,GOD remember the scene where gaston steps on some cabbages except cabbages are super dense and hard to actually sma… https://t.co/YWP7nHFgVp,GOD remember scene gaston steps cabbages except cabbages super dense hard actually sma… https //t.co/YWP7nHFgVp,0.013888888888888876
1030169010355224577,Thu Aug 16 19:06:46 +0000 2018,live action batb writers: what if we made gaston.... nice? yeah! yeah what if we just made him a nice jock type? th… https://t.co/RZvXUuH0JQ,live action batb writers made gaston ... nice yeah yeah made nice jock type th… https //t.co/RZvXUuH0JQ,0.35909090909090907
1030168572054700032,Thu Aug 16 19:05:01 +0000 2018,@alizabees also i wouldve turned it off the moment they had the opening sequence where the beast just kinda has a h… https://t.co/ZXQ9ySY2XH,alizabees also wouldve turned moment opening sequence beast kinda h… https //t.co/ZXQ9ySY2XH,0.0
1030168314545426432,Thu Aug 16 19:04:00 +0000 2018,@alizabees *beast voice* to be fair you have to have a very high iq to understand rick and m,alizabees *beast voice* fair high iq understand rick,0.43
1030167388757680133,Thu Aug 16 19:00:19 +0000 2018,i forgot they made lefou open quote gay close quote the real gays are lumiere and cogsworth you Cowards,forgot made lefou open quote gay close quote real gays lumiere cogsworth Cowards,0.20555555555555557
1030166289929654276,Thu Aug 16 18:55:57 +0000 2018,im back in denmark and im sick and ive decided to watch the live actiom beauty and the beast to see if its as bad a… https://t.co/ZGTmIhYLXZ,im back denmark im sick ive decided watch live actiom beauty beast see bad a… https //t.co/ZGTmIhYLXZ,-0.3194805194805195
1030164421107228672,Thu Aug 16 18:48:32 +0000 2018,@rennerei @geezmarty mom holy fuck!!,rennerei geezmarty mom holy fuck,-0.4
1029863581020565506,Wed Aug 15 22:53:06 +0000 2018,"@stripeyworm the navy pier in chicago is fun, also!",stripeyworm navy pier chicago fun also,0.3
1029863344180809730,Wed Aug 15 22:52:09 +0000 2018,@stripeyworm oh shit i actually know these ones. you should check out house on the rock in wisconsin because the fi… https://t.co/nw4ubp6xuq,stripeyworm oh shit actually know ones check house rock wisconsin fi… https //t.co/nw4ubp6xuq,-0.1
1029844325159579648,Wed Aug 15 21:36:35 +0000 2018,@Dihuh did everyone just have the same style of pseudo chibi art as a teen because you couldve told me i drew this and i wouldnt bat an eye,Dihuh everyone style pseudo chibi art teen couldve told drew wouldnt bat eye,0.0
1029843830579912712,Wed Aug 15 21:34:37 +0000 2018,when i stayed in the usa as a kid there were a bunch of squirrels in the neighbourhood and i wanted to feed them so… https://t.co/R1XX6DbfdH,stayed usa kid bunch squirrels neighbourhood wanted feed so… https //t.co/R1XX6DbfdH,0.0
1029842184332345344,Wed Aug 15 21:28:04 +0000 2018,@peabuggy lmfao we have a rotating roster of professors for each week for the most part and theyre all on the young… https://t.co/fD8HjfMGqd,peabuggy lmfao rotating roster professors week part theyre young… https //t.co/fD8HjfMGqd,0.0
1029835109111934977,Wed Aug 15 20:59:58 +0000 2018,@Narsysus yea any kind of arts! i said animation cause thats my field lol,Narsysus yea kind arts said animation cause thats field lol,0.7
1029833635086721044,Wed Aug 15 20:54:06 +0000 2018,im curious because after seeing that wreck it ralph animators video it got me thinkin abt how my class is like 90% women,im curious seeing wreck ralph animators video got thinkin abt class like 90 women,-0.1
1029833066943078406,Wed Aug 15 20:51:51 +0000 2018,"quick poll, if you went to art/animation school, your class was",quick poll went art/animation school class,0.3333333333333333
1029821195003342848,Wed Aug 15 20:04:40 +0000 2018,"gonna get #real for a second here but, i think, calling works like nakamura-kun, doukyuusei and whatever else ppl h… https://t.co/68nin3BHjX",gon na get real second think calling works like nakamura-kun doukyuusei whatever else ppl h… https //t.co/68nin3BHjX,0.0
1029401992089751552,Tue Aug 14 16:18:54 +0000 2018,"@SamanthaCKing no yeah absolutely like, when i first heard abt the game i Assumed it was abt the opioids crisis sin… https://t.co/n2peHnrFGJ",SamanthaCKing yeah absolutely like first heard abt game Assumed abt opioids crisis sin… https //t.co/n2peHnrFGJ,0.016666666666666663
1029400618769760256,Tue Aug 14 16:13:27 +0000 2018,@SamanthaCKing the opioids crisis is like a perfectly valid thing to do a videogame abt but the specific way they d… https://t.co/5UhEARRll2,SamanthaCKing opioids crisis like perfectly valid thing videogame abt specific way d… https //t.co/5UhEARRll2,0.5
1029399866315812864,Tue Aug 14 16:10:28 +0000 2018,with book 1 of peritale having just wrapped up and with 300 pages behind it would yall like me to open chapter cove… https://t.co/akYAmCz3rg,book 1 peritale wrapped 300 pages behind would yall like open chapter cove… https //t.co/akYAmCz3rg,-0.2
1029393297993818112,Tue Aug 14 15:44:22 +0000 2018,@kinomatika natural ingredients should be fine i think! since i never use makeup i just end up buying cheap shit an… https://t.co/D1SCZGly8b,kinomatika natural ingredients fine think since never use makeup end buying cheap shit an… https //t.co/D1SCZGly8b,0.1791666666666667
1029392833571119104,Tue Aug 14 15:42:31 +0000 2018,"@kinomatika nah not smells, im just made of glass and have to be careful w allergens",kinomatika nah smells im made glass careful w allergens,-0.1
1029391918927675394,Tue Aug 14 15:38:53 +0000 2018,"@kinomatika ohh thanks so much kino! i’ll look into all of these!! any any of them in particular for more sensitive skin, also?",kinomatika ohh thanks much kino ’ look particular sensitive skin also,0.16666666666666666
1029381962614681601,Tue Aug 14 14:59:19 +0000 2018,life of melody... https://t.co/aLo2XZt7p0,life melody ... https //t.co/aLo2XZt7p0,0.0
1029380679379939328,Tue Aug 14 14:54:13 +0000 2018,@charmwitch me too lol!! its a nightmare,charmwitch lol nightmare,0.8
1029380606298415105,Tue Aug 14 14:53:56 +0000 2018,"@kinomatika its combo i think. oily forehead/chin, regular everything else",kinomatika combo think oily forehead/chin regular everything else,0.0
1029380112800776192,Tue Aug 14 14:51:58 +0000 2018,"@kinomatika ohh... i do need, i barely know how to do “the natural look” lmao",kinomatika ohh ... need barely know “ natural look ” lmao,0.25
1029379979421917184,Tue Aug 14 14:51:26 +0000 2018,@charmwitch yea i have wicked sensitive skin too so most products irritate me if i wear em too long,charmwitch yea wicked sensitive skin products irritate wear em long,0.025
1029378412752904192,Tue Aug 14 14:45:13 +0000 2018,why is makeup so hard to get into why does everything have 50 different names and application methods how did anyon… https://t.co/1E6YYGEU56,makeup hard get everything 50 different names application methods anyon… https //t.co/1E6YYGEU56,-0.14583333333333334
1029295795210731520,Tue Aug 14 09:16:55 +0000 2018,@geezmarty if i put one showtunes/disney song in a character playlist no matter how many other songs it has the onl… https://t.co/eUKTdlo3J7,geezmarty put one showtunes/disney song character playlist matter many songs onl… https //t.co/eUKTdlo3J7,0.5
1029143748410847232,Mon Aug 13 23:12:44 +0000 2018,goth dads https://t.co/VNaf3opV3Q,goth dads https //t.co/VNaf3opV3Q,0.0
1029099499438972928,Mon Aug 13 20:16:55 +0000 2018,"https://t.co/pLbtpccdlo updated! Today’s guest art is by @effsie! ❤️ #hiveworks

(RT, please!) https://t.co/BU2KX8NSH6",https //t.co/pLbtpccdlo updated Today ’ guest art effsie ❤️ hiveworks RT please https //t.co/BU2KX8NSH6,0.0
1029025099532455947,Mon Aug 13 15:21:16 +0000 2018,@effsie WUV THEM,effsie WUV THEM,0.0
1028890702963531777,Mon Aug 13 06:27:14 +0000 2018,@Snarlbear ohhhhh offended... thats the peak hydrangea expression i love this so much!!! 😭💖,Snarlbear ohhhhh offended ... thats peak hydrangea expression love much 😭💖,0.35
1028781211282538504,Sun Aug 12 23:12:09 +0000 2018,@Secondlina hooray!,Secondlina hooray,0.0
1028743278898950144,Sun Aug 12 20:41:25 +0000 2018,@alizabees do i gotta say a char if i already did on side twit? either way hydrangea again,alizabees got ta say char already side twit either way hydrangea,0.0
1028703451079954433,Sun Aug 12 18:03:09 +0000 2018,just some goils https://t.co/hc4ESvydCm,goils https //t.co/hc4ESvydCm,0.0
1028640326943170561,Sun Aug 12 13:52:19 +0000 2018,@cerigg ahhhh anyone from https://t.co/3gr0tCNa48,cerigg ahhhh anyone https //t.co/3gr0tCNa48,0.0
1028312961494872064,Sat Aug 11 16:11:29 +0000 2018,i dont draw within my Twink Comfort Zone too often https://t.co/zi3Z1OjTRV,dont draw within Twink Comfort Zone often https //t.co/zi3Z1OjTRV,0.0
1028003793034768384,Fri Aug 10 19:42:58 +0000 2018,@paranaturalzack @Friends_Table u draw jacqui so perfect......,paranaturalzack Friends_Table u draw jacqui perfect ... ...,1.0
1028003052698173440,Fri Aug 10 19:40:01 +0000 2018,@paranaturalzack @Friends_Table OHHHH MY GOD ZACK I LOVE THIS,paranaturalzack Friends_Table OHHHH MY GOD ZACK I LOVE THIS,0.5
1028002321203122176,Fri Aug 10 19:37:07 +0000 2018,i did it....... @mangalheiro @mimiadraws @geezmarty @enenkay @lesbianravenna @kinomatika @aryllins @effsie @mayakern https://t.co/6H2CIcJtdK,... ... mangalheiro mimiadraws geezmarty enenkay lesbianravenna kinomatika aryllins effsie mayakern https //t.co/6H2CIcJtdK,0.0
1027979741826084864,Fri Aug 10 18:07:24 +0000 2018,@geezmarty @HannahTempler @cornhime @insertdisc5 @potatofuzz @mikimuun @stripeyworm @alizabees @lesbianravenna HAAA… https://t.co/EpGDclMpNe,geezmarty HannahTempler cornhime insertdisc5 potatofuzz mikimuun stripeyworm alizabees lesbianravenna HAAA… https //t.co/EpGDclMpNe,0.0
1027919344750219269,Fri Aug 10 14:07:24 +0000 2018,@kinomatika m.. me.. anyone from peritale?,kinomatika m.. me.. anyone peritale,0.0
1027671179857985537,Thu Aug 09 21:41:17 +0000 2018,@dokirosi thank u so much im so clueless!! 😭😭and omg im excited!!!,dokirosi thank u much im clueless 😭😭and omg im excited,0.2875
1027656202317176832,Thu Aug 09 20:41:46 +0000 2018,@dokirosi ohhh i didnt know that!! luckily for now im prob only doing pink pearl so not as many gaps. also im def b… https://t.co/uzFEbEmOiW,dokirosi ohhh didnt know luckily im prob pink pearl many gaps also im def b… https //t.co/uzFEbEmOiW,0.24444444444444444
1027654978540892162,Thu Aug 09 20:36:54 +0000 2018,@DominickHannah3 looks better,DominickHannah3 looks better,0.5
1027643544398442496,Thu Aug 09 19:51:28 +0000 2018,Tell Me What You Want,Tell Me What You Want,0.0
1027599045060177921,Thu Aug 09 16:54:38 +0000 2018,"Today's https://t.co/3gr0tCNa48 guest art is by @Rendigo, author of fellow The Weave, and it's super stunning!!… https://t.co/yXIfjvrWwS",Today 's https //t.co/3gr0tCNa48 guest art Rendigo author fellow The Weave 's super stunning … https //t.co/yXIfjvrWwS,0.41666666666666663
1027591309693997056,Thu Aug 09 16:23:54 +0000 2018,@Secondlina oh my goddddd,Secondlina oh goddddd,0.0
1027540700966084614,Thu Aug 09 13:02:48 +0000 2018,@ReyMathilde1 if one of them does well theres a chance i might open pre-orders for all of them!,ReyMathilde1 one well theres chance might open pre-orders,0.0
1027530125447970817,Thu Aug 09 12:20:47 +0000 2018,i can probably only afford to make one of these,probably afford make one,0.0
